year_month,rebal_date,regime_label,regime_reason,dominant_category_effects,sector_tilt,style_tilt,n_ow_stocks,n_uw_stocks,top_ow_details,top_uw_details,all_ow_details,all_uw_details
2025-09,2025-09-09,Bullish / Low Volatility,"21d EW Ret=+2.29% → Bullish | 21d Vol(ann)=8.6% → Low Volatility | Leading: Healthcare(+7.11%), Lagging: Utilities(-2.11%)",Accounting(50.4%) > Price(20.3%) > Sellside(19.0%) > Conditioning(9.7%) > Factor(0.7%),Technology(+14.0%) | Healthcare(+5.9%) | Communication(+2.9%) | Consumer Staples(+2.3%) | Industrials(+0.7%) | Financials(-1.1%) | Utilities(-1.6%) | Energy(-2.4%) | Materials(-3.2%) | Real Estate(-4.7%) | Semiconductors(-6.4%) | Consumer Disc.(-6.4%),Value(+7.2%) | Growth(+3.8%) | Cyclical(+2.4%) | Defensive(-1.7%) | Quality(-5.0%) | Quality Growth(-6.7%),10,33,"PLTR[Technology/Growth/Data Analytics / AI](AW=+10.5%, Very strong positive signal (z=5.79)) | ABBV[Healthcare/Value/Pharma / Biotech](AW=+10.5%, Mild positive signal (z=0.17)) | LITE[Technology/Cyclical/Photonics / Fiber](AW=+6.7%, Mild positive signal (z=0.07)) | GEV[Industrials/Cyclical/Power Equipment](AW=+5.9%, Strong positive signal (z=0.71)) | SPGI[Financials/Quality/Data / Rating](AW=+4.6%, Optimizer risk-adjusted OW despite negative signal (z=-0.05)) | NFLX[Communication/Growth/Streaming](AW=+4.3%, Mild positive signal (z=0.37)) | LMT[Industrials/Defensive/Defense / Aerospace](AW=+3.4%, Mild positive signal (z=0.40)) | COST[Consumer Staples/Quality Growth/Warehouse Retail](AW=+2.7%, Mild positive signal (z=0.10)) | PG[Consumer Staples/Defensive/Household Products](AW=+1.2%, Mild positive signal (z=0.23)) | GOOGL[Communication/Quality Growth/Digital Advertising](AW=+0.2%, Mild positive signal (z=0.18))","LNG[Energy/Value](AW=-1.6%, Mild negative signal (z=-0.17)) | UNH[Healthcare/Quality](AW=-1.6%, Strong negative signal (z=-0.95)) | ETN[Industrials/Quality Growth](AW=-1.6%, Mild negative signal (z=-0.18)) | BLK[Financials/Quality](AW=-1.6%, Strong negative signal (z=-0.90)) | EQIX[Real Estate/Growth](AW=-1.6%, Strong negative signal (z=-0.59)) | PLD[Real Estate/Quality](AW=-1.6%, Mild negative signal (z=-0.01)) | AMD[Semiconductors/Growth](AW=-1.6%, Strong negative signal (z=-1.19)) | MCD[Consumer Disc./Defensive](AW=-1.6%, Mild negative signal (z=-0.14)) | AMZN[Consumer Disc./Growth](AW=-1.6%, Positive signal but BM cap-weight dominates (z=0.03)) | MA[Financials/Quality Growth](AW=-1.6%, Mild negative signal (z=-0.12))","PLTR[Technology/Growth/Data Analytics / AI](AW=+10.5%, Very strong positive signal (z=5.79)) | ABBV[Healthcare/Value/Pharma / Biotech](AW=+10.5%, Mild positive signal (z=0.17)) | LITE[Technology/Cyclical/Photonics / Fiber](AW=+6.7%, Mild positive signal (z=0.07)) | GEV[Industrials/Cyclical/Power Equipment](AW=+5.9%, Strong positive signal (z=0.71)) | SPGI[Financials/Quality/Data / Rating](AW=+4.6%, Optimizer risk-adjusted OW despite negative signal (z=-0.05)) | NFLX[Communication/Growth/Streaming](AW=+4.3%, Mild positive signal (z=0.37)) | LMT[Industrials/Defensive/Defense / Aerospace](AW=+3.4%, Mild positive signal (z=0.40)) | COST[Consumer Staples/Quality Growth/Warehouse Retail](AW=+2.7%, Mild positive signal (z=0.10)) | PG[Consumer Staples/Defensive/Household Products](AW=+1.2%, Mild positive signal (z=0.23)) | GOOGL[Communication/Quality Growth/Digital Advertising](AW=+0.2%, Mild positive signal (z=0.18))","LNG[Energy/Value](AW=-1.6%, Mild negative signal (z=-0.17)) | UNH[Healthcare/Quality](AW=-1.6%, Strong negative signal (z=-0.95)) | ETN[Industrials/Quality Growth](AW=-1.6%, Mild negative signal (z=-0.18)) | BLK[Financials/Quality](AW=-1.6%, Strong negative signal (z=-0.90)) | EQIX[Real Estate/Growth](AW=-1.6%, Strong negative signal (z=-0.59)) | PLD[Real Estate/Quality](AW=-1.6%, Mild negative signal (z=-0.01)) | AMD[Semiconductors/Growth](AW=-1.6%, Strong negative signal (z=-1.19)) | MCD[Consumer Disc./Defensive](AW=-1.6%, Mild negative signal (z=-0.14)) | AMZN[Consumer Disc./Growth](AW=-1.6%, Positive signal but BM cap-weight dominates (z=0.03)) | MA[Financials/Quality Growth](AW=-1.6%, Mild negative signal (z=-0.12)) | V[Financials/Quality Growth](AW=-1.6%, Positive signal but BM cap-weight dominates (z=0.11)) | BE[Industrials/Growth](AW=-1.6%, Mild negative signal (z=-0.22)) | NEE[Utilities/Defensive](AW=-1.6%, Mild negative signal (z=-0.43)) | ISRG[Healthcare/Growth](AW=-1.6%, Positive signal but BM cap-weight dominates (z=0.25)) | MU[Semiconductors/Cyclical](AW=-1.6%, Strong negative signal (z=-2.44)) | AAPL[Technology/Quality Growth](AW=-1.6%, Mild negative signal (z=-0.38)) | MSFT[Technology/Quality Growth](AW=-1.6%, Mild negative signal (z=-0.02)) | DE[Industrials/Cyclical](AW=-1.6%, Mild negative signal (z=-0.17)) | WMT[Consumer Staples/Defensive](AW=-1.6%, Positive signal but BM cap-weight dominates (z=0.19)) | FCX[Materials/Cyclical](AW=-1.6%, Strong negative signal (z=-0.78)) | HON[Industrials/Quality](AW=-1.6%, Positive signal but BM cap-weight dominates (z=0.04)) | CAT[Industrials/Cyclical](AW=-1.6%, Mild negative signal (z=-0.44)) | 000660[Semiconductors/Cyclical](AW=-1.6%, Mild negative signal (z=-0.02)) | LIN[Materials/Quality](AW=-1.6%, Mild negative signal (z=-0.08)) | TSLA[Consumer Disc./Growth](AW=-1.6%, Strong negative signal (z=-1.47)) | META[Communication/Quality Growth](AW=-1.6%, Mild negative signal (z=-0.27)) | 005930[Semiconductors/Cyclical](AW=-1.6%, Positive signal but BM cap-weight dominates (z=0.09)) | HD[Consumer Disc./Quality](AW=-1.6%, Strong negative signal (z=-0.51)) | AMT[Real Estate/Defensive](AW=-1.5%, Positive signal but BM cap-weight dominates (z=0.53)) | LLY[Healthcare/Growth](AW=-1.4%, Positive signal but BM cap-weight dominates (z=0.10)) | GS[Financials/Value](AW=-0.9%, Positive signal but BM cap-weight dominates (z=0.37)) | XOM[Energy/Value](AW=-0.8%, Positive signal but BM cap-weight dominates (z=0.22)) | VRT[Industrials/Cyclical](AW=-0.6%, Positive signal but BM cap-weight dominates (z=0.20))"
2025-10,2025-10-02,Bullish / Low Volatility,"21d EW Ret=+6.03% → Bullish | 21d Vol(ann)=8.2% → Low Volatility | Leading: Semiconductors(+20.90%), Lagging: Materials(-7.57%)",Accounting(50.4%) > Price(20.3%) > Sellside(19.0%) > Conditioning(9.7%) > Factor(0.7%),Consumer Staples(+8.6%) | Technology(+7.3%) | Communication(+5.9%) | Healthcare(+5.0%) | Financials(-1.1%) | Utilities(-1.6%) | Energy(-2.4%) | Materials(-3.2%) | Real Estate(-3.5%) | Industrials(-3.8%) | Semiconductors(-4.8%) | Consumer Disc.(-6.4%),Growth(+8.6%) | Value(+6.3%) | Quality Growth(-1.0%) | Cyclical(-2.7%) | Defensive(-5.1%) | Quality(-6.1%),6,34,"PLTR[Technology/Growth/Data Analytics / AI](AW=+10.5%, Very strong positive signal (z=2.81)) | COST[Consumer Staples/Quality Growth/Warehouse Retail](AW=+10.2%, Strong positive signal (z=0.83)) | ABBV[Healthcare/Value/Pharma / Biotech](AW=+9.7%, Strong positive signal (z=0.67)) | NFLX[Communication/Growth/Streaming](AW=+9.1%, Very strong positive signal (z=1.43)) | GEV[Industrials/Cyclical/Power Equipment](AW=+5.9%, Strong positive signal (z=0.83)) | SPGI[Financials/Quality/Data / Rating](AW=+4.6%, Strong positive signal (z=0.64))","LNG[Energy/Value](AW=-1.6%, Strong negative signal (z=-1.46)) | GOOGL[Communication/Quality Growth](AW=-1.6%, Mild negative signal (z=-0.34)) | TSLA[Consumer Disc./Growth](AW=-1.6%, Mild negative signal (z=-0.05)) | MU[Semiconductors/Cyclical](AW=-1.6%, Strong negative signal (z=-4.11)) | EQIX[Real Estate/Growth](AW=-1.6%, Strong negative signal (z=-0.76)) | AMD[Semiconductors/Growth](AW=-1.6%, Strong negative signal (z=-2.14)) | 000660[Semiconductors/Cyclical](AW=-1.6%, Strong negative signal (z=-1.58)) | FCX[Materials/Cyclical](AW=-1.6%, Strong negative signal (z=-0.81)) | ETN[Industrials/Quality Growth](AW=-1.6%, Mild negative signal (z=-0.37)) | UNH[Healthcare/Quality](AW=-1.6%, Positive signal but BM cap-weight dominates (z=0.45))","PLTR[Technology/Growth/Data Analytics / AI](AW=+10.5%, Very strong positive signal (z=2.81)) | COST[Consumer Staples/Quality Growth/Warehouse Retail](AW=+10.2%, Strong positive signal (z=0.83)) | ABBV[Healthcare/Value/Pharma / Biotech](AW=+9.7%, Strong positive signal (z=0.67)) | NFLX[Communication/Growth/Streaming](AW=+9.1%, Very strong positive signal (z=1.43)) | GEV[Industrials/Cyclical/Power Equipment](AW=+5.9%, Strong positive signal (z=0.83)) | SPGI[Financials/Quality/Data / Rating](AW=+4.6%, Strong positive signal (z=0.64))","LNG[Energy/Value](AW=-1.6%, Strong negative signal (z=-1.46)) | GOOGL[Communication/Quality Growth](AW=-1.6%, Mild negative signal (z=-0.34)) | TSLA[Consumer Disc./Growth](AW=-1.6%, Mild negative signal (z=-0.05)) | MU[Semiconductors/Cyclical](AW=-1.6%, Strong negative signal (z=-4.11)) | EQIX[Real Estate/Growth](AW=-1.6%, Strong negative signal (z=-0.76)) | AMD[Semiconductors/Growth](AW=-1.6%, Strong negative signal (z=-2.14)) | 000660[Semiconductors/Cyclical](AW=-1.6%, Strong negative signal (z=-1.58)) | FCX[Materials/Cyclical](AW=-1.6%, Strong negative signal (z=-0.81)) | ETN[Industrials/Quality Growth](AW=-1.6%, Mild negative signal (z=-0.37)) | UNH[Healthcare/Quality](AW=-1.6%, Positive signal but BM cap-weight dominates (z=0.45)) | NEE[Utilities/Defensive](AW=-1.6%, Strong negative signal (z=-0.68)) | LIN[Materials/Quality](AW=-1.6%, Mild negative signal (z=-0.25)) | MCD[Consumer Disc./Defensive](AW=-1.6%, Mild negative signal (z=-0.14)) | HON[Industrials/Quality](AW=-1.6%, Positive signal but BM cap-weight dominates (z=0.52)) | PLD[Real Estate/Quality](AW=-1.6%, Positive signal but BM cap-weight dominates (z=0.30)) | DE[Industrials/Cyclical](AW=-1.6%, Positive signal but BM cap-weight dominates (z=0.07)) | BLK[Financials/Quality](AW=-1.6%, Mild negative signal (z=-0.13)) | AMZN[Consumer Disc./Growth](AW=-1.6%, Mild negative signal (z=-0.36)) | MA[Financials/Quality Growth](AW=-1.6%, Positive signal but BM cap-weight dominates (z=0.49)) | BE[Industrials/Growth](AW=-1.6%, Strong negative signal (z=-0.93)) | CAT[Industrials/Cyclical](AW=-1.6%, Strong negative signal (z=-0.62)) | WMT[Consumer Staples/Defensive](AW=-1.6%, Positive signal but BM cap-weight dominates (z=0.21)) | ISRG[Healthcare/Growth](AW=-1.6%, Positive signal but BM cap-weight dominates (z=0.76)) | V[Financials/Quality Growth](AW=-1.6%, Positive signal but BM cap-weight dominates (z=0.07)) | AAPL[Technology/Quality Growth](AW=-1.6%, Positive signal but BM cap-weight dominates (z=0.09)) | MSFT[Technology/Quality Growth](AW=-1.6%, Mild negative signal (z=-0.34)) | HD[Consumer Disc./Quality](AW=-1.6%, Strong negative signal (z=-0.57)) | META[Communication/Quality Growth](AW=-1.6%, Positive signal but BM cap-weight dominates (z=0.21)) | LLY[Healthcare/Growth](AW=-1.4%, Mild negative signal (z=-0.30)) | UNP[Industrials/Quality](AW=-1.1%, Mild negative signal (z=-0.30)) | GS[Financials/Value](AW=-0.9%, Positive signal but BM cap-weight dominates (z=0.17)) | XOM[Energy/Value](AW=-0.8%, Positive signal but BM cap-weight dominates (z=0.03)) | VRT[Industrials/Cyclical](AW=-0.6%, Mild negative signal (z=-0.20)) | AMT[Real Estate/Defensive](AW=-0.3%, Positive signal but BM cap-weight dominates (z=0.77))"
2025-11,2025-11-06,Bullish / Low Volatility,"21d EW Ret=+5.12% → Bullish | 21d Vol(ann)=13.7% → Low Volatility | Leading: Semiconductors(+15.94%), Lagging: Materials(-6.77%)",Accounting(50.4%) > Price(20.3%) > Sellside(19.0%) > Conditioning(9.7%) > Factor(0.7%),Healthcare(+14.8%) | Technology(+5.7%) | Financials(+4.8%) | Energy(-0.8%) | Utilities(-1.6%) | Consumer Staples(-1.6%) | Materials(-3.2%) | Real Estate(-3.5%) | Industrials(-3.6%) | Semiconductors(-4.8%) | Consumer Disc.(-6.4%),Quality(+10.1%) | Value(+8.8%) | Growth(+4.4%) | GARP(-1.6%) | Defensive(-5.1%) | Cyclical(-5.3%) | Quality Growth(-11.2%),6,34,"ABBV[Healthcare/Value/Pharma / Biotech](AW=+10.5%, Mild positive signal (z=0.48)) | PLTR[Technology/Growth/Data Analytics / AI](AW=+10.5%, Very strong positive signal (z=5.18)) | SPGI[Financials/Quality/Data / Rating](AW=+10.5%, Very strong positive signal (z=1.68)) | UNH[Healthcare/Quality/Managed Care](AW=+7.5%, Very strong positive signal (z=1.11)) | GEV[Industrials/Cyclical/Power Equipment](AW=+5.9%, Strong positive signal (z=1.00)) | NFLX[Communication/Growth/Streaming](AW=+5.1%, Optimizer risk-adjusted OW despite negative signal (z=-0.26))","LLY[Healthcare/Growth](AW=-1.6%, Positive signal but BM cap-weight dominates (z=0.12)) | LITE[Technology/Cyclical](AW=-1.6%, Strong negative signal (z=-1.02)) | EQIX[Real Estate/Growth](AW=-1.6%, Mild negative signal (z=-0.24)) | WMT[Consumer Staples/Defensive](AW=-1.6%, Positive signal but BM cap-weight dominates (z=0.06)) | GOOGL[Communication/Quality Growth](AW=-1.6%, Mild negative signal (z=-0.23)) | NEE[Utilities/Defensive](AW=-1.6%, Strong negative signal (z=-0.54)) | FCX[Materials/Cyclical](AW=-1.6%, Mild negative signal (z=-0.41)) | VRT[Industrials/Cyclical](AW=-1.6%, Mild negative signal (z=-0.17)) | PLD[Real Estate/Quality](AW=-1.6%, Mild negative signal (z=-0.48)) | DE[Industrials/Cyclical](AW=-1.6%, Positive signal but BM cap-weight dominates (z=0.17))","ABBV[Healthcare/Value/Pharma / Biotech](AW=+10.5%, Mild positive signal (z=0.48)) | PLTR[Technology/Growth/Data Analytics / AI](AW=+10.5%, Very strong positive signal (z=5.18)) | SPGI[Financials/Quality/Data / Rating](AW=+10.5%, Very strong positive signal (z=1.68)) | UNH[Healthcare/Quality/Managed Care](AW=+7.5%, Very strong positive signal (z=1.11)) | GEV[Industrials/Cyclical/Power Equipment](AW=+5.9%, Strong positive signal (z=1.00)) | NFLX[Communication/Growth/Streaming](AW=+5.1%, Optimizer risk-adjusted OW despite negative signal (z=-0.26))","LLY[Healthcare/Growth](AW=-1.6%, Positive signal but BM cap-weight dominates (z=0.12)) | LITE[Technology/Cyclical](AW=-1.6%, Strong negative signal (z=-1.02)) | EQIX[Real Estate/Growth](AW=-1.6%, Mild negative signal (z=-0.24)) | WMT[Consumer Staples/Defensive](AW=-1.6%, Positive signal but BM cap-weight dominates (z=0.06)) | GOOGL[Communication/Quality Growth](AW=-1.6%, Mild negative signal (z=-0.23)) | NEE[Utilities/Defensive](AW=-1.6%, Strong negative signal (z=-0.54)) | FCX[Materials/Cyclical](AW=-1.6%, Mild negative signal (z=-0.41)) | VRT[Industrials/Cyclical](AW=-1.6%, Mild negative signal (z=-0.17)) | PLD[Real Estate/Quality](AW=-1.6%, Mild negative signal (z=-0.48)) | DE[Industrials/Cyclical](AW=-1.6%, Positive signal but BM cap-weight dominates (z=0.17)) | ETN[Industrials/Quality Growth](AW=-1.6%, Mild negative signal (z=-0.40)) | MCD[Consumer Disc./Defensive](AW=-1.6%, Mild negative signal (z=-0.15)) | TSLA[Consumer Disc./Growth](AW=-1.6%, Strong negative signal (z=-0.65)) | BLK[Financials/Quality](AW=-1.6%, Mild negative signal (z=-0.03)) | 000660[Semiconductors/Cyclical](AW=-1.6%, Strong negative signal (z=-2.52)) | CAT[Industrials/Cyclical](AW=-1.6%, Positive signal but BM cap-weight dominates (z=0.26)) | AMD[Semiconductors/Growth](AW=-1.6%, Strong negative signal (z=-0.71)) | AAPL[Technology/Quality Growth](AW=-1.6%, Mild negative signal (z=-0.29)) | ISRG[Healthcare/Growth](AW=-1.6%, Mild negative signal (z=-0.24)) | LIN[Materials/Quality](AW=-1.6%, Positive signal but BM cap-weight dominates (z=0.01)) | TMUS[Communication/GARP](AW=-1.6%, Positive signal but BM cap-weight dominates (z=0.18)) | MU[Semiconductors/Cyclical](AW=-1.6%, Strong negative signal (z=-1.69)) | MA[Financials/Quality Growth](AW=-1.6%, Mild negative signal (z=-0.31)) | AMZN[Consumer Disc./Growth](AW=-1.6%, Mild negative signal (z=-0.44)) | BE[Industrials/Growth](AW=-1.6%, Strong negative signal (z=-1.06)) | V[Financials/Quality Growth](AW=-1.6%, Positive signal but BM cap-weight dominates (z=0.01)) | META[Communication/Quality Growth](AW=-1.6%, Mild negative signal (z=-0.17)) | HD[Consumer Disc./Quality](AW=-1.6%, Mild negative signal (z=-0.31)) | MSFT[Technology/Quality Growth](AW=-1.6%, Positive signal but BM cap-weight dominates (z=0.17)) | UNP[Industrials/Quality](AW=-1.1%, Positive signal but BM cap-weight dominates (z=0.19)) | GS[Financials/Value](AW=-0.9%, Positive signal but BM cap-weight dominates (z=0.63)) | XOM[Energy/Value](AW=-0.8%, Mild negative signal (z=-0.31)) | HON[Industrials/Quality](AW=-0.4%, Mild negative signal (z=-0.25)) | AMT[Real Estate/Defensive](AW=-0.3%, Positive signal but BM cap-weight dominates (z=0.10))"
2025-12,2025-12-11,Bullish / Low Volatility,"21d EW Ret=+3.74% → Bullish | 21d Vol(ann)=12.7% → Low Volatility | Leading: Technology(+12.87%), Lagging: Energy(-5.58%)",Accounting(50.4%) > Price(20.3%) > Sellside(19.0%) > Conditioning(9.7%) > Factor(0.7%),Financials(+10.0%) | Energy(+5.9%) | Healthcare(+5.7%) | Technology(+5.7%) | Utilities(-1.6%) | Materials(-1.6%) | Industrials(-2.5%) | Consumer Staples(-2.9%) | Real Estate(-3.2%) | Communication(-4.3%) | Consumer Disc.(-4.8%) | Semiconductors(-6.4%),Quality(+12.6%) | Value(+10.2%) | Growth(+0.9%) | Defensive(-1.6%) | GARP(-2.7%) | Cyclical(-6.9%) | Quality Growth(-12.5%),7,33,"PLTR[Technology/Growth/Data Analytics / AI](AW=+10.5%, Very strong positive signal (z=2.25)) | UNH[Healthcare/Quality/Managed Care](AW=+10.5%, Very strong positive signal (z=1.56)) | SPGI[Financials/Quality/Data / Rating](AW=+10.5%, Very strong positive signal (z=1.90)) | LNG[Energy/Value/LNG / Natural Gas](AW=+6.7%, Very strong positive signal (z=1.39)) | GEV[Industrials/Cyclical/Power Equipment](AW=+4.3%, Strong positive signal (z=0.78)) | JPM[Financials/Value/Banking](AW=+4.3%, Very strong positive signal (z=1.16)) | LMT[Industrials/Defensive/Defense / Aerospace](AW=+3.2%, Strong positive signal (z=0.80))","BLK[Financials/Quality](AW=-1.6%, Mild negative signal (z=-0.11)) | UNP[Industrials/Quality](AW=-1.6%, Mild negative signal (z=-0.39)) | LITE[Technology/Cyclical](AW=-1.6%, Strong negative signal (z=-2.64)) | LLY[Healthcare/Growth](AW=-1.6%, Positive signal but BM cap-weight dominates (z=0.35)) | NEE[Utilities/Defensive](AW=-1.6%, Strong negative signal (z=-1.60)) | GOOGL[Communication/Quality Growth](AW=-1.6%, Strong negative signal (z=-1.11)) | AMD[Semiconductors/Growth](AW=-1.6%, Strong negative signal (z=-1.89)) | TSLA[Consumer Disc./Growth](AW=-1.6%, Strong negative signal (z=-1.49)) | MU[Semiconductors/Cyclical](AW=-1.6%, Strong negative signal (z=-2.06)) | WMT[Consumer Staples/Defensive](AW=-1.6%, Mild negative signal (z=-0.27))","PLTR[Technology/Growth/Data Analytics / AI](AW=+10.5%, Very strong positive signal (z=2.25)) | UNH[Healthcare/Quality/Managed Care](AW=+10.5%, Very strong positive signal (z=1.56)) | SPGI[Financials/Quality/Data / Rating](AW=+10.5%, Very strong positive signal (z=1.90)) | LNG[Energy/Value/LNG / Natural Gas](AW=+6.7%, Very strong positive signal (z=1.39)) | GEV[Industrials/Cyclical/Power Equipment](AW=+4.3%, Strong positive signal (z=0.78)) | JPM[Financials/Value/Banking](AW=+4.3%, Very strong positive signal (z=1.16)) | LMT[Industrials/Defensive/Defense / Aerospace](AW=+3.2%, Strong positive signal (z=0.80))","BLK[Financials/Quality](AW=-1.6%, Mild negative signal (z=-0.11)) | UNP[Industrials/Quality](AW=-1.6%, Mild negative signal (z=-0.39)) | LITE[Technology/Cyclical](AW=-1.6%, Strong negative signal (z=-2.64)) | LLY[Healthcare/Growth](AW=-1.6%, Positive signal but BM cap-weight dominates (z=0.35)) | NEE[Utilities/Defensive](AW=-1.6%, Strong negative signal (z=-1.60)) | GOOGL[Communication/Quality Growth](AW=-1.6%, Strong negative signal (z=-1.11)) | AMD[Semiconductors/Growth](AW=-1.6%, Strong negative signal (z=-1.89)) | TSLA[Consumer Disc./Growth](AW=-1.6%, Strong negative signal (z=-1.49)) | MU[Semiconductors/Cyclical](AW=-1.6%, Strong negative signal (z=-2.06)) | WMT[Consumer Staples/Defensive](AW=-1.6%, Mild negative signal (z=-0.27)) | PLD[Real Estate/Quality](AW=-1.6%, Mild negative signal (z=-0.49)) | 000660[Semiconductors/Cyclical](AW=-1.6%, Strong negative signal (z=-1.51)) | EQIX[Real Estate/Growth](AW=-1.6%, Mild negative signal (z=-0.32)) | BE[Industrials/Growth](AW=-1.6%, Strong negative signal (z=-0.91)) | MCD[Consumer Disc./Defensive](AW=-1.6%, Mild negative signal (z=-0.33)) | VRT[Industrials/Cyclical](AW=-1.6%, Mild negative signal (z=-0.15)) | LIN[Materials/Quality](AW=-1.6%, Positive signal but BM cap-weight dominates (z=0.42)) | ISRG[Healthcare/Growth](AW=-1.6%, Mild negative signal (z=-0.08)) | ETN[Industrials/Quality Growth](AW=-1.6%, Positive signal but BM cap-weight dominates (z=0.08)) | AAPL[Technology/Quality Growth](AW=-1.6%, Mild negative signal (z=-0.30)) | DE[Industrials/Cyclical](AW=-1.6%, Mild negative signal (z=-0.10)) | HD[Consumer Disc./Quality](AW=-1.6%, Mild negative signal (z=-0.08)) | CAT[Industrials/Cyclical](AW=-1.6%, Positive signal but BM cap-weight dominates (z=0.06)) | MA[Financials/Quality Growth](AW=-1.6%, Mild negative signal (z=-0.19)) | META[Communication/Quality Growth](AW=-1.6%, Mild negative signal (z=-0.11)) | V[Financials/Quality Growth](AW=-1.6%, Positive signal but BM cap-weight dominates (z=0.25)) | MSFT[Technology/Quality Growth](AW=-1.6%, Positive signal but BM cap-weight dominates (z=0.34)) | 005930[Semiconductors/Cyclical](AW=-1.6%, Strong negative signal (z=-1.95)) | REGN[Healthcare/GARP](AW=-1.6%, Positive signal but BM cap-weight dominates (z=0.49)) | COST[Consumer Staples/Quality Growth](AW=-1.3%, Positive signal but BM cap-weight dominates (z=0.39)) | TMUS[Communication/GARP](AW=-1.1%, Positive signal but BM cap-weight dominates (z=0.62)) | XOM[Energy/Value](AW=-0.8%, Positive signal but BM cap-weight dominates (z=0.03)) | HON[Industrials/Quality](AW=-0.4%, Positive signal but BM cap-weight dominates (z=0.48))"
