year_month,rebal_date,regime_label,regime_reason,dominant_category_effects,sector_tilt,style_tilt,n_ow_stocks,n_uw_stocks,top_ow_details,top_uw_details,all_ow_details,all_uw_details
2025-10,2025-10-03,Bullish / Low Volatility,"21d EW Ret=+7.39% -> Bullish | 21d Vol(ann)=8.6% -> Low Volatility | Leading: Semiconductors(+23.33%), Lagging: Materials(-6.77%)",Accounting(44.8%) > Price(24.1%) > Sellside(16.5%) > Growth(8.5%) > Factor(4.8%) > Conditioning(1.4%),Technology(+23.5%) | Semiconductors(+10.5%) | Communication(+6.3%) | Consumer Disc.(-1.2%) | Utilities(-2.1%) | Consumer Staples(-2.7%) | Energy(-2.7%) | Materials(-4.0%) | Industrials(-6.1%) | Financials(-6.2%) | Real Estate(-6.2%) | Healthcare(-9.1%),Quality Growth(+20.6%) | Cyclical(+8.4%) | Growth(+1.2%) | GARP(-1.3%) | Value(-3.5%) | Defensive(-8.9%) | Quality(-16.6%),11,36,"NVDA[Semiconductors/Growth/AI / GPU](AW=+12.7%, Very strong positive signal (z=1.76)) | GEV[Industrials/Cyclical/Power Equipment](AW=+10.4%, Very strong positive signal (z=3.28)) | LITE[Technology/Cyclical/Photonics / Fiber](AW=+10.0%, Very strong positive signal (z=1.93)) | MSFT[Technology/Quality Growth/Enterprise Software](AW=+9.7%, Strong positive signal (z=0.61)) | GOOGL[Communication/Quality Growth/Digital Advertising](AW=+7.0%, Strong positive signal (z=0.70)) | AAPL[Technology/Quality Growth/Consumer Electronics](AW=+6.7%, Mild positive signal (z=0.21)) | META[Communication/Quality Growth/Social Media](AW=+3.4%, Strong positive signal (z=0.82)) | AVGO[Semiconductors/GARP/Networking Chips](AW=+2.9%, Very strong positive signal (z=1.71)) | TSLA[Consumer Disc./Growth/EV / Energy Storage](AW=+2.3%, Strong positive signal (z=0.71)) | AMZN[Consumer Disc./Growth/E-Commerce / Cloud](AW=+0.6%, Optimizer risk-adjusted OW despite negative signal (z=-0.10))","LNG[Energy/Value](AW=-2.1%, Mild negative signal (z=-0.24)) | VRT[Industrials/Cyclical](AW=-2.1%, Mild negative signal (z=-0.34)) | REGN[Healthcare/GARP](AW=-2.1%, Strong negative signal (z=-0.90)) | EQIX[Real Estate/Growth](AW=-2.1%, Strong negative signal (z=-1.71)) | AMT[Real Estate/Defensive](AW=-2.1%, Strong negative signal (z=-1.06)) | DE[Industrials/Cyclical](AW=-2.1%, Strong negative signal (z=-1.77)) | HON[Industrials/Quality](AW=-2.1%, Strong negative signal (z=-1.01)) | SPGI[Financials/Quality](AW=-2.1%, Strong negative signal (z=-0.70)) | ISRG[Healthcare/Growth](AW=-2.1%, Strong negative signal (z=-0.91)) | PLD[Real Estate/Quality](AW=-2.1%, Mild negative signal (z=-0.32))","NVDA[Semiconductors/Growth/AI / GPU](AW=+12.7%, Very strong positive signal (z=1.76)) | GEV[Industrials/Cyclical/Power Equipment](AW=+10.4%, Very strong positive signal (z=3.28)) | LITE[Technology/Cyclical/Photonics / Fiber](AW=+10.0%, Very strong positive signal (z=1.93)) | MSFT[Technology/Quality Growth/Enterprise Software](AW=+9.7%, Strong positive signal (z=0.61)) | GOOGL[Communication/Quality Growth/Digital Advertising](AW=+7.0%, Strong positive signal (z=0.70)) | AAPL[Technology/Quality Growth/Consumer Electronics](AW=+6.7%, Mild positive signal (z=0.21)) | META[Communication/Quality Growth/Social Media](AW=+3.4%, Strong positive signal (z=0.82)) | AVGO[Semiconductors/GARP/Networking Chips](AW=+2.9%, Very strong positive signal (z=1.71)) | TSLA[Consumer Disc./Growth/EV / Energy Storage](AW=+2.3%, Strong positive signal (z=0.71)) | AMZN[Consumer Disc./Growth/E-Commerce / Cloud](AW=+0.6%, Optimizer risk-adjusted OW despite negative signal (z=-0.10)) | WMT[Consumer Staples/Defensive/Discount Retail](AW=+0.4%, Strong positive signal (z=0.53))","LNG[Energy/Value](AW=-2.1%, Mild negative signal (z=-0.24)) | VRT[Industrials/Cyclical](AW=-2.1%, Mild negative signal (z=-0.34)) | REGN[Healthcare/GARP](AW=-2.1%, Strong negative signal (z=-0.90)) | EQIX[Real Estate/Growth](AW=-2.1%, Strong negative signal (z=-1.71)) | AMT[Real Estate/Defensive](AW=-2.1%, Strong negative signal (z=-1.06)) | DE[Industrials/Cyclical](AW=-2.1%, Strong negative signal (z=-1.77)) | HON[Industrials/Quality](AW=-2.1%, Strong negative signal (z=-1.01)) | SPGI[Financials/Quality](AW=-2.1%, Strong negative signal (z=-0.70)) | ISRG[Healthcare/Growth](AW=-2.1%, Strong negative signal (z=-0.91)) | PLD[Real Estate/Quality](AW=-2.1%, Mild negative signal (z=-0.32)) | CRM[Technology/Growth](AW=-2.1%, Strong negative signal (z=-1.10)) | LMT[Industrials/Defensive](AW=-2.1%, Mild negative signal (z=-0.03)) | TMUS[Communication/GARP](AW=-2.1%, Strong negative signal (z=-1.50)) | UNP[Industrials/Quality](AW=-2.1%, Mild negative signal (z=-0.41)) | ETN[Industrials/Quality Growth](AW=-2.1%, Mild negative signal (z=-0.28)) | NEE[Utilities/Defensive](AW=-2.1%, Mild negative signal (z=-0.09)) | BLK[Financials/Quality](AW=-2.1%, Strong negative signal (z=-0.64)) | COST[Consumer Staples/Quality Growth](AW=-2.1%, Strong negative signal (z=-1.75)) | MCD[Consumer Disc./Defensive](AW=-2.1%, Mild negative signal (z=-0.20)) | LIN[Materials/Quality](AW=-2.1%, Strong negative signal (z=-0.60)) | CAT[Industrials/Cyclical](AW=-2.1%, Mild negative signal (z=-0.46)) | UNH[Healthcare/Quality](AW=-2.1%, Mild negative signal (z=-0.19)) | HD[Consumer Disc./Quality](AW=-2.1%, Mild negative signal (z=-0.41)) | NFLX[Communication/Growth](AW=-2.1%, Positive signal but BM cap-weight dominates (z=0.03)) | MA[Financials/Quality Growth](AW=-2.1%, Mild negative signal (z=-0.28)) | LLY[Healthcare/Growth](AW=-2.0%, Strong negative signal (z=-0.52)) | BE[Industrials/Growth](AW=-2.0%, Positive signal but BM cap-weight dominates (z=0.88)) | FCX[Materials/Cyclical](AW=-1.9%, Positive signal but BM cap-weight dominates (z=0.30)) | 000660[Semiconductors/Cyclical](AW=-1.5%, Positive signal but BM cap-weight dominates (z=0.62)) | MU[Semiconductors/Cyclical](AW=-1.4%, Positive signal but BM cap-weight dominates (z=1.64)) | AMD[Semiconductors/Growth](AW=-1.3%, Positive signal but BM cap-weight dominates (z=0.02)) | PG[Consumer Staples/Defensive](AW=-1.0%, Positive signal but BM cap-weight dominates (z=0.50)) | 005930[Semiconductors/Cyclical](AW=-0.9%, Positive signal but BM cap-weight dominates (z=0.48)) | PLTR[Technology/Growth](AW=-0.8%, Mild negative signal (z=-0.08)) | ABBV[Healthcare/Value](AW=-0.8%, Positive signal but BM cap-weight dominates (z=0.35)) | XOM[Energy/Value](AW=-0.6%, Positive signal but BM cap-weight dominates (z=0.07))"
2025-11,2025-11-14,Bullish / Normal Volatility,"21d EW Ret=+2.43% -> Bullish | 21d Vol(ann)=15.6% -> Normal Volatility | Leading: Semiconductors(+11.77%), Lagging: Materials(-4.79%)",Accounting(44.8%) > Price(24.1%) > Sellside(16.5%) > Growth(8.5%) > Factor(4.8%) > Conditioning(1.4%),Technology(+26.3%) | Semiconductors(+12.1%) | Communication(+5.1%) | Consumer Staples(+3.2%) | Utilities(-2.1%) | Energy(-2.7%) | Materials(-4.1%) | Real Estate(-6.2%) | Financials(-6.4%) | Healthcare(-9.1%) | Industrials(-15.7%),Quality Growth(+17.3%) | Growth(+5.6%) | Cyclical(+1.0%) | GARP(-0.7%) | Defensive(-3.1%) | Value(-3.5%) | Quality(-16.6%),13,34,"NVDA[Semiconductors/Growth/AI / GPU](AW=+11.7%, Very strong positive signal (z=1.60)) | LITE[Technology/Cyclical/Photonics / Fiber](AW=+10.0%, Very strong positive signal (z=1.86)) | MSFT[Technology/Quality Growth/Enterprise Software](AW=+9.2%, Very strong positive signal (z=1.02)) | GOOGL[Communication/Quality Growth/Digital Advertising](AW=+7.6%, Mild positive signal (z=0.15)) | AAPL[Technology/Quality Growth/Consumer Electronics](AW=+7.3%, Mild positive signal (z=0.14)) | PG[Consumer Staples/Defensive/Household Products](AW=+4.9%, Very strong positive signal (z=1.26)) | AVGO[Semiconductors/GARP/Networking Chips](AW=+2.7%, Strong positive signal (z=0.78)) | TSLA[Consumer Disc./Growth/EV / Energy Storage](AW=+1.9%, Mild positive signal (z=0.42)) | PLTR[Technology/Growth/Data Analytics / AI](AW=+1.9%, Very strong positive signal (z=2.76)) | AMZN[Consumer Disc./Growth/E-Commerce / Cloud](AW=+1.8%, Mild positive signal (z=0.01))","LNG[Energy/Value](AW=-2.1%, Strong negative signal (z=-1.74)) | VRT[Industrials/Cyclical](AW=-2.1%, Strong negative signal (z=-0.85)) | REGN[Healthcare/GARP](AW=-2.1%, Strong negative signal (z=-0.84)) | EQIX[Real Estate/Growth](AW=-2.1%, Strong negative signal (z=-0.83)) | HON[Industrials/Quality](AW=-2.1%, Strong negative signal (z=-1.09)) | AMT[Real Estate/Defensive](AW=-2.1%, Strong negative signal (z=-0.88)) | FCX[Materials/Cyclical](AW=-2.1%, Strong negative signal (z=-0.53)) | DE[Industrials/Cyclical](AW=-2.1%, Strong negative signal (z=-0.81)) | SPGI[Financials/Quality](AW=-2.1%, Strong negative signal (z=-1.24)) | LMT[Industrials/Defensive](AW=-2.1%, Mild negative signal (z=-0.22))","NVDA[Semiconductors/Growth/AI / GPU](AW=+11.7%, Very strong positive signal (z=1.60)) | LITE[Technology/Cyclical/Photonics / Fiber](AW=+10.0%, Very strong positive signal (z=1.86)) | MSFT[Technology/Quality Growth/Enterprise Software](AW=+9.2%, Very strong positive signal (z=1.02)) | GOOGL[Communication/Quality Growth/Digital Advertising](AW=+7.6%, Mild positive signal (z=0.15)) | AAPL[Technology/Quality Growth/Consumer Electronics](AW=+7.3%, Mild positive signal (z=0.14)) | PG[Consumer Staples/Defensive/Household Products](AW=+4.9%, Very strong positive signal (z=1.26)) | AVGO[Semiconductors/GARP/Networking Chips](AW=+2.7%, Strong positive signal (z=0.78)) | TSLA[Consumer Disc./Growth/EV / Energy Storage](AW=+1.9%, Mild positive signal (z=0.42)) | PLTR[Technology/Growth/Data Analytics / AI](AW=+1.9%, Very strong positive signal (z=2.76)) | AMZN[Consumer Disc./Growth/E-Commerce / Cloud](AW=+1.8%, Mild positive signal (z=0.01)) | GEV[Industrials/Cyclical/Power Equipment](AW=+0.9%, Mild positive signal (z=0.19)) | MU[Semiconductors/Cyclical/Memory](AW=+0.6%, Very strong positive signal (z=1.71)) | WMT[Consumer Staples/Defensive/Discount Retail](AW=+0.4%, Very strong positive signal (z=1.37))","LNG[Energy/Value](AW=-2.1%, Strong negative signal (z=-1.74)) | VRT[Industrials/Cyclical](AW=-2.1%, Strong negative signal (z=-0.85)) | REGN[Healthcare/GARP](AW=-2.1%, Strong negative signal (z=-0.84)) | EQIX[Real Estate/Growth](AW=-2.1%, Strong negative signal (z=-0.83)) | HON[Industrials/Quality](AW=-2.1%, Strong negative signal (z=-1.09)) | AMT[Real Estate/Defensive](AW=-2.1%, Strong negative signal (z=-0.88)) | FCX[Materials/Cyclical](AW=-2.1%, Strong negative signal (z=-0.53)) | DE[Industrials/Cyclical](AW=-2.1%, Strong negative signal (z=-0.81)) | SPGI[Financials/Quality](AW=-2.1%, Strong negative signal (z=-1.24)) | LMT[Industrials/Defensive](AW=-2.1%, Mild negative signal (z=-0.22)) | PLD[Real Estate/Quality](AW=-2.1%, Mild negative signal (z=-0.46)) | UNP[Industrials/Quality](AW=-2.1%, Mild negative signal (z=-0.38)) | ETN[Industrials/Quality Growth](AW=-2.1%, Mild negative signal (z=-0.33)) | BLK[Financials/Quality](AW=-2.1%, Strong negative signal (z=-0.84)) | ISRG[Healthcare/Growth](AW=-2.1%, Strong negative signal (z=-0.83)) | NEE[Utilities/Defensive](AW=-2.1%, Mild negative signal (z=-0.40)) | LIN[Materials/Quality](AW=-2.1%, Mild negative signal (z=-0.49)) | COST[Consumer Staples/Quality Growth](AW=-2.1%, Strong negative signal (z=-1.34)) | MCD[Consumer Disc./Defensive](AW=-2.1%, Mild negative signal (z=-0.37)) | CRM[Technology/Growth](AW=-2.1%, Positive signal but BM cap-weight dominates (z=0.17)) | CAT[Industrials/Cyclical](AW=-2.1%, Strong negative signal (z=-0.92)) | UNH[Healthcare/Quality](AW=-2.1%, Strong negative signal (z=-0.75)) | HD[Consumer Disc./Quality](AW=-2.1%, Strong negative signal (z=-0.95)) | MA[Financials/Quality Growth](AW=-2.1%, Mild negative signal (z=-0.50)) | LLY[Healthcare/Growth](AW=-2.0%, Strong negative signal (z=-0.59)) | BE[Industrials/Growth](AW=-2.0%, Positive signal but BM cap-weight dominates (z=0.25)) | TMUS[Communication/GARP](AW=-1.4%, Positive signal but BM cap-weight dominates (z=0.83)) | 000660[Semiconductors/Cyclical](AW=-1.2%, Positive signal but BM cap-weight dominates (z=0.73)) | 005930[Semiconductors/Cyclical](AW=-0.9%, Positive signal but BM cap-weight dominates (z=0.56)) | AMD[Semiconductors/Growth](AW=-0.9%, Positive signal but BM cap-weight dominates (z=0.81)) | ABBV[Healthcare/Value](AW=-0.9%, Positive signal but BM cap-weight dominates (z=0.15)) | NFLX[Communication/Growth](AW=-0.7%, Positive signal but BM cap-weight dominates (z=1.26)) | XOM[Energy/Value](AW=-0.6%, Positive signal but BM cap-weight dominates (z=0.57)) | META[Communication/Quality Growth](AW=-0.4%, Strong negative signal (z=-1.56))"
2025-12,2025-12-12,Sideways / Normal Volatility,"21d EW Ret=-0.00% -> Sideways | 21d Vol(ann)=15.5% -> Normal Volatility | Leading: Technology(+6.64%), Lagging: Energy(-5.15%)",Accounting(44.8%) > Price(24.1%) > Sellside(16.5%) > Growth(8.5%) > Factor(4.8%) > Conditioning(1.4%),Technology(+23.0%) | Semiconductors(+8.1%) | Utilities(+5.4%) | Communication(+5.3%) | Consumer Staples(+2.7%) | Energy(-2.6%) | Materials(-3.4%) | Financials(-4.8%) | Real Estate(-6.2%) | Healthcare(-9.2%) | Industrials(-18.1%),Quality Growth(+17.4%) | Growth(+8.7%) | Defensive(+4.0%) | GARP(-0.8%) | Value(-3.6%) | Cyclical(-9.7%) | Quality(-16.0%),12,35,"NVDA[Semiconductors/Growth/AI / GPU](AW=+9.9%, Optimizer risk-adjusted OW despite negative signal (z=-0.20)) | GOOGL[Communication/Quality Growth/Digital Advertising](AW=+8.1%, Optimizer risk-adjusted OW despite negative signal (z=-0.74)) | MSFT[Technology/Quality Growth/Enterprise Software](AW=+8.0%, Optimizer risk-adjusted OW despite negative signal (z=-0.29)) | AAPL[Technology/Quality Growth/Consumer Electronics](AW=+6.5%, Optimizer risk-adjusted OW despite negative signal (z=-0.77)) | PLTR[Technology/Growth/Data Analytics / AI](AW=+6.5%, Very strong positive signal (z=2.26)) | NEE[Utilities/Defensive/Renewables / Utilities](AW=+5.4%, Very strong positive signal (z=3.16)) | PG[Consumer Staples/Defensive/Household Products](AW=+4.3%, Very strong positive signal (z=1.50)) | LITE[Technology/Cyclical/Photonics / Fiber](AW=+3.4%, Mild positive signal (z=0.24)) | AVGO[Semiconductors/GARP/Networking Chips](AW=+2.7%, Optimizer risk-adjusted OW despite negative signal (z=-0.46)) | TSLA[Consumer Disc./Growth/EV / Energy Storage](AW=+2.4%, Strong positive signal (z=0.87))","VRT[Industrials/Cyclical](AW=-2.1%, Mild negative signal (z=-0.21)) | EQIX[Real Estate/Growth](AW=-2.1%, Mild negative signal (z=-0.43)) | REGN[Healthcare/GARP](AW=-2.1%, Strong negative signal (z=-0.79)) | AMT[Real Estate/Defensive](AW=-2.1%, Mild negative signal (z=-0.23)) | DE[Industrials/Cyclical](AW=-2.1%, Strong negative signal (z=-0.57)) | HON[Industrials/Quality](AW=-2.1%, Positive signal but BM cap-weight dominates (z=0.27)) | PLD[Real Estate/Quality](AW=-2.1%, Strong negative signal (z=-0.91)) | ETN[Industrials/Quality Growth](AW=-2.1%, Mild negative signal (z=-0.31)) | LMT[Industrials/Defensive](AW=-2.1%, Mild negative signal (z=-0.25)) | UNP[Industrials/Quality](AW=-2.1%, Mild negative signal (z=-0.28))","NVDA[Semiconductors/Growth/AI / GPU](AW=+9.9%, Optimizer risk-adjusted OW despite negative signal (z=-0.20)) | GOOGL[Communication/Quality Growth/Digital Advertising](AW=+8.1%, Optimizer risk-adjusted OW despite negative signal (z=-0.74)) | MSFT[Technology/Quality Growth/Enterprise Software](AW=+8.0%, Optimizer risk-adjusted OW despite negative signal (z=-0.29)) | AAPL[Technology/Quality Growth/Consumer Electronics](AW=+6.5%, Optimizer risk-adjusted OW despite negative signal (z=-0.77)) | PLTR[Technology/Growth/Data Analytics / AI](AW=+6.5%, Very strong positive signal (z=2.26)) | NEE[Utilities/Defensive/Renewables / Utilities](AW=+5.4%, Very strong positive signal (z=3.16)) | PG[Consumer Staples/Defensive/Household Products](AW=+4.3%, Very strong positive signal (z=1.50)) | LITE[Technology/Cyclical/Photonics / Fiber](AW=+3.4%, Mild positive signal (z=0.24)) | AVGO[Semiconductors/GARP/Networking Chips](AW=+2.7%, Optimizer risk-adjusted OW despite negative signal (z=-0.46)) | TSLA[Consumer Disc./Growth/EV / Energy Storage](AW=+2.4%, Strong positive signal (z=0.87)) | AMZN[Consumer Disc./Growth/E-Commerce / Cloud](AW=+1.5%, Optimizer risk-adjusted OW despite negative signal (z=-1.65)) | WMT[Consumer Staples/Defensive/Discount Retail](AW=+0.5%, Optimizer risk-adjusted OW despite negative signal (z=-0.58))","VRT[Industrials/Cyclical](AW=-2.1%, Mild negative signal (z=-0.21)) | EQIX[Real Estate/Growth](AW=-2.1%, Mild negative signal (z=-0.43)) | REGN[Healthcare/GARP](AW=-2.1%, Strong negative signal (z=-0.79)) | AMT[Real Estate/Defensive](AW=-2.1%, Mild negative signal (z=-0.23)) | DE[Industrials/Cyclical](AW=-2.1%, Strong negative signal (z=-0.57)) | HON[Industrials/Quality](AW=-2.1%, Positive signal but BM cap-weight dominates (z=0.27)) | PLD[Real Estate/Quality](AW=-2.1%, Strong negative signal (z=-0.91)) | ETN[Industrials/Quality Growth](AW=-2.1%, Mild negative signal (z=-0.31)) | LMT[Industrials/Defensive](AW=-2.1%, Mild negative signal (z=-0.25)) | UNP[Industrials/Quality](AW=-2.1%, Mild negative signal (z=-0.28)) | BLK[Financials/Quality](AW=-2.1%, Strong negative signal (z=-0.51)) | ISRG[Healthcare/Growth](AW=-2.1%, Strong negative signal (z=-0.52)) | MCD[Consumer Disc./Defensive](AW=-2.1%, Strong negative signal (z=-0.70)) | SPGI[Financials/Quality](AW=-2.1%, Positive signal but BM cap-weight dominates (z=0.36)) | CAT[Industrials/Cyclical](AW=-2.1%, Strong negative signal (z=-1.32)) | UNH[Healthcare/Quality](AW=-2.1%, Strong negative signal (z=-0.93)) | HD[Consumer Disc./Quality](AW=-2.1%, Mild negative signal (z=-0.02)) | COST[Consumer Staples/Quality Growth](AW=-2.1%, Strong negative signal (z=-0.56)) | LLY[Healthcare/Growth](AW=-2.0%, Mild negative signal (z=-0.34)) | BE[Industrials/Growth](AW=-2.0%, Positive signal but BM cap-weight dominates (z=1.14)) | LNG[Energy/Value](AW=-2.0%, Positive signal but BM cap-weight dominates (z=1.50)) | FCX[Materials/Cyclical](AW=-1.9%, Mild negative signal (z=-0.19)) | GEV[Industrials/Cyclical](AW=-1.5%, Positive signal but BM cap-weight dominates (z=0.21)) | LIN[Materials/Quality](AW=-1.5%, Positive signal but BM cap-weight dominates (z=0.69)) | TMUS[Communication/GARP](AW=-1.4%, Positive signal but BM cap-weight dominates (z=1.19)) | CRM[Technology/Growth](AW=-1.4%, Positive signal but BM cap-weight dominates (z=0.76)) | MU[Semiconductors/Cyclical](AW=-1.3%, Positive signal but BM cap-weight dominates (z=1.11)) | 000660[Semiconductors/Cyclical](AW=-1.3%, Positive signal but BM cap-weight dominates (z=2.22)) | AMD[Semiconductors/Growth](AW=-1.1%, Mild negative signal (z=-0.38)) | NFLX[Communication/Growth](AW=-0.9%, Strong negative signal (z=-0.83)) | ABBV[Healthcare/Value](AW=-0.9%, Positive signal but BM cap-weight dominates (z=0.72)) | 005930[Semiconductors/Cyclical](AW=-0.8%, Strong negative signal (z=-1.29)) | XOM[Energy/Value](AW=-0.7%, Mild negative signal (z=-0.35)) | MA[Financials/Quality Growth](AW=-0.6%, Mild negative signal (z=-0.33)) | META[Communication/Quality Growth](AW=-0.4%, Strong negative signal (z=-1.01))"
2026-01,2026-01-09,Bullish / Low Volatility,"21d EW Ret=+3.86% -> Bullish | 21d Vol(ann)=11.5% -> Low Volatility | Leading: Materials(+16.32%), Lagging: Technology(-2.67%)",Accounting(44.8%) > Price(24.1%) > Sellside(16.5%) > Growth(8.5%) > Factor(4.8%) > Conditioning(1.4%),Technology(+19.5%) | Semiconductors(+18.6%) | Communication(+4.7%) | Consumer Staples(+2.4%) | Utilities(-1.6%) | Energy(-2.6%) | Materials(-3.3%) | Financials(-4.9%) | Real Estate(-6.0%) | Healthcare(-9.2%) | Industrials(-17.4%),Quality Growth(+16.0%) | Growth(+12.0%) | GARP(-1.1%) | Defensive(-3.1%) | Value(-3.6%) | Cyclical(-4.6%) | Quality(-15.6%),11,36,"NVDA[Semiconductors/Growth/AI / GPU](AW=+10.3%, Optimizer risk-adjusted OW despite negative signal (z=-0.19)) | PLTR[Technology/Growth/Data Analytics / AI](AW=+9.4%, Very strong positive signal (z=1.70)) | 000660[Semiconductors/Cyclical/Memory (KR)](AW=+8.6%, Very strong positive signal (z=3.41)) | GOOGL[Communication/Quality Growth/Digital Advertising](AW=+8.5%, Optimizer risk-adjusted OW despite negative signal (z=-0.70)) | MSFT[Technology/Quality Growth/Enterprise Software](AW=+7.7%, Optimizer risk-adjusted OW despite negative signal (z=-0.18)) | AAPL[Technology/Quality Growth/Consumer Electronics](AW=+5.7%, Optimizer risk-adjusted OW despite negative signal (z=-0.28)) | PG[Consumer Staples/Defensive/Household Products](AW=+4.1%, Very strong positive signal (z=1.11)) | AVGO[Semiconductors/GARP/Networking Chips](AW=+2.4%, Optimizer risk-adjusted OW despite negative signal (z=-0.18)) | TSLA[Consumer Disc./Growth/EV / Energy Storage](AW=+2.2%, Strong positive signal (z=0.70)) | AMZN[Consumer Disc./Growth/E-Commerce / Cloud](AW=+1.7%, Optimizer risk-adjusted OW despite negative signal (z=-0.80))","VRT[Industrials/Cyclical](AW=-2.1%, Mild negative signal (z=-0.23)) | REGN[Healthcare/GARP](AW=-2.1%, Strong negative signal (z=-1.21)) | EQIX[Real Estate/Growth](AW=-2.1%, Mild negative signal (z=-0.36)) | DE[Industrials/Cyclical](AW=-2.1%, Strong negative signal (z=-0.52)) | PLD[Real Estate/Quality](AW=-2.1%, Strong negative signal (z=-0.66)) | UNP[Industrials/Quality](AW=-2.1%, Mild negative signal (z=-0.23)) | BLK[Financials/Quality](AW=-2.1%, Strong negative signal (z=-0.74)) | LMT[Industrials/Defensive](AW=-2.1%, Mild negative signal (z=-0.42)) | ISRG[Healthcare/Growth](AW=-2.1%, Strong negative signal (z=-0.84)) | MCD[Consumer Disc./Defensive](AW=-2.1%, Strong negative signal (z=-0.66))","NVDA[Semiconductors/Growth/AI / GPU](AW=+10.3%, Optimizer risk-adjusted OW despite negative signal (z=-0.19)) | PLTR[Technology/Growth/Data Analytics / AI](AW=+9.4%, Very strong positive signal (z=1.70)) | 000660[Semiconductors/Cyclical/Memory (KR)](AW=+8.6%, Very strong positive signal (z=3.41)) | GOOGL[Communication/Quality Growth/Digital Advertising](AW=+8.5%, Optimizer risk-adjusted OW despite negative signal (z=-0.70)) | MSFT[Technology/Quality Growth/Enterprise Software](AW=+7.7%, Optimizer risk-adjusted OW despite negative signal (z=-0.18)) | AAPL[Technology/Quality Growth/Consumer Electronics](AW=+5.7%, Optimizer risk-adjusted OW despite negative signal (z=-0.28)) | PG[Consumer Staples/Defensive/Household Products](AW=+4.1%, Very strong positive signal (z=1.11)) | AVGO[Semiconductors/GARP/Networking Chips](AW=+2.4%, Optimizer risk-adjusted OW despite negative signal (z=-0.18)) | TSLA[Consumer Disc./Growth/EV / Energy Storage](AW=+2.2%, Strong positive signal (z=0.70)) | AMZN[Consumer Disc./Growth/E-Commerce / Cloud](AW=+1.7%, Optimizer risk-adjusted OW despite negative signal (z=-0.80)) | WMT[Consumer Staples/Defensive/Discount Retail](AW=+0.4%, Optimizer risk-adjusted OW despite negative signal (z=-0.31))","VRT[Industrials/Cyclical](AW=-2.1%, Mild negative signal (z=-0.23)) | REGN[Healthcare/GARP](AW=-2.1%, Strong negative signal (z=-1.21)) | EQIX[Real Estate/Growth](AW=-2.1%, Mild negative signal (z=-0.36)) | DE[Industrials/Cyclical](AW=-2.1%, Strong negative signal (z=-0.52)) | PLD[Real Estate/Quality](AW=-2.1%, Strong negative signal (z=-0.66)) | UNP[Industrials/Quality](AW=-2.1%, Mild negative signal (z=-0.23)) | BLK[Financials/Quality](AW=-2.1%, Strong negative signal (z=-0.74)) | LMT[Industrials/Defensive](AW=-2.1%, Mild negative signal (z=-0.42)) | ISRG[Healthcare/Growth](AW=-2.1%, Strong negative signal (z=-0.84)) | MCD[Consumer Disc./Defensive](AW=-2.1%, Strong negative signal (z=-0.66)) | CAT[Industrials/Cyclical](AW=-2.1%, Strong negative signal (z=-1.00)) | UNH[Healthcare/Quality](AW=-2.1%, Strong negative signal (z=-0.65)) | SPGI[Financials/Quality](AW=-2.1%, Mild negative signal (z=-0.10)) | HD[Consumer Disc./Quality](AW=-2.1%, Mild negative signal (z=-0.29)) | COST[Consumer Staples/Quality Growth](AW=-2.1%, Strong negative signal (z=-1.34)) | LLY[Healthcare/Growth](AW=-2.0%, Mild negative signal (z=-0.36)) | LITE[Technology/Cyclical](AW=-2.0%, Positive signal but BM cap-weight dominates (z=3.33)) | BE[Industrials/Growth](AW=-2.0%, Strong negative signal (z=-0.90)) | LNG[Energy/Value](AW=-2.0%, Positive signal but BM cap-weight dominates (z=1.19)) | AMT[Real Estate/Defensive](AW=-1.9%, Positive signal but BM cap-weight dominates (z=0.67)) | FCX[Materials/Cyclical](AW=-1.8%, Positive signal but BM cap-weight dominates (z=0.57)) | HON[Industrials/Quality](AW=-1.7%, Mild negative signal (z=-0.06)) | ETN[Industrials/Quality Growth](AW=-1.7%, Positive signal but BM cap-weight dominates (z=0.44)) | NEE[Utilities/Defensive](AW=-1.6%, Strong negative signal (z=-0.97)) | GEV[Industrials/Cyclical](AW=-1.6%, Mild negative signal (z=-0.04)) | LIN[Materials/Quality](AW=-1.5%, Positive signal but BM cap-weight dominates (z=0.14)) | META[Communication/Quality Growth](AW=-1.5%, Strong negative signal (z=-1.10)) | TMUS[Communication/GARP](AW=-1.4%, Positive signal but BM cap-weight dominates (z=0.83)) | CRM[Technology/Growth](AW=-1.4%, Positive signal but BM cap-weight dominates (z=0.07)) | AMD[Semiconductors/Growth](AW=-1.1%, Positive signal but BM cap-weight dominates (z=0.85)) | ABBV[Healthcare/Value](AW=-1.0%, Mild negative signal (z=-0.04)) | MU[Semiconductors/Cyclical](AW=-1.0%, Positive signal but BM cap-weight dominates (z=1.19)) | NFLX[Communication/Growth](AW=-0.9%, Positive signal but BM cap-weight dominates (z=0.84)) | XOM[Energy/Value](AW=-0.6%, Strong negative signal (z=-0.60)) | MA[Financials/Quality Growth](AW=-0.6%, Mild negative signal (z=-0.18)) | 005930[Semiconductors/Cyclical](AW=-0.5%, Strong negative signal (z=-0.66))"
