year_month,rebal_date,regime_label,regime_reason,dominant_category_effects,sector_tilt,style_tilt,n_ow_stocks,n_uw_stocks,top_ow_details,top_uw_details,all_ow_details,all_uw_details
2025-09,2025-09-09,Bullish / Low Volatility,"21d EW Ret=+2.29% → Bullish | 21d Vol(ann)=8.6% → Low Volatility | Leading: Healthcare(+7.11%), Lagging: Utilities(-2.11%)",Accounting(56.0%) > Price(19.7%) > Sellside(14.4%) > Conditioning(8.7%) > Factor(1.3%),Semiconductors(+20.2%) | Industrials(+6.5%) | Healthcare(+4.1%) | Utilities(-1.6%) | Communication(-1.6%) | Consumer Disc.(-2.7%) | Energy(-2.9%) | Materials(-3.2%) | Technology(-4.2%) | Consumer Staples(-4.7%) | Real Estate(-4.8%) | Financials(-5.1%),Cyclical(+16.2%) | Value(+6.0%) | GARP(+5.4%) | Defensive(+0.6%) | Quality Growth(-7.4%) | Quality(-8.0%) | Growth(-12.8%),7,34,"ABBV[Healthcare/Value/Pharma / Biotech](AW=+10.5%, Mild positive signal (z=0.27)) | 000660[Semiconductors/Cyclical/Memory (KR)](AW=+10.5%, Very strong positive signal (z=1.88)) | AVGO[Semiconductors/GARP/Networking Chips](AW=+8.6%, Mild positive signal (z=0.28)) | LMT[Industrials/Defensive/Defense / Aerospace](AW=+8.0%, Mild positive signal (z=0.39)) | 005930[Semiconductors/Cyclical/Foundry / Memory (KR)](AW=+5.9%, Strong positive signal (z=0.78)) | GEV[Industrials/Cyclical/Power Equipment](AW=+3.6%, Strong positive signal (z=0.79)) | VRT[Industrials/Cyclical/Data Center Cooling](AW=+2.9%, Mild positive signal (z=0.20))","ETN[Industrials/Quality Growth](AW=-1.6%, Positive signal but BM cap-weight dominates (z=0.22)) | HON[Industrials/Quality](AW=-1.6%, Positive signal but BM cap-weight dominates (z=0.43)) | COST[Consumer Staples/Quality Growth](AW=-1.6%, Positive signal but BM cap-weight dominates (z=0.06)) | DE[Industrials/Cyclical](AW=-1.6%, Positive signal but BM cap-weight dominates (z=0.31)) | CAT[Industrials/Cyclical](AW=-1.6%, Positive signal but BM cap-weight dominates (z=0.17)) | NVDA[Semiconductors/Growth](AW=-1.6%, Positive signal but BM cap-weight dominates (z=0.14)) | CRM[Technology/Growth](AW=-1.6%, Positive signal but BM cap-weight dominates (z=0.56)) | FCX[Materials/Cyclical](AW=-1.6%, Strong negative signal (z=-2.04)) | AMD[Semiconductors/Growth](AW=-1.6%, Strong negative signal (z=-2.20)) | BLK[Financials/Quality](AW=-1.6%, Strong negative signal (z=-0.96))","ABBV[Healthcare/Value/Pharma / Biotech](AW=+10.5%, Mild positive signal (z=0.27)) | 000660[Semiconductors/Cyclical/Memory (KR)](AW=+10.5%, Very strong positive signal (z=1.88)) | AVGO[Semiconductors/GARP/Networking Chips](AW=+8.6%, Mild positive signal (z=0.28)) | LMT[Industrials/Defensive/Defense / Aerospace](AW=+8.0%, Mild positive signal (z=0.39)) | 005930[Semiconductors/Cyclical/Foundry / Memory (KR)](AW=+5.9%, Strong positive signal (z=0.78)) | GEV[Industrials/Cyclical/Power Equipment](AW=+3.6%, Strong positive signal (z=0.79)) | VRT[Industrials/Cyclical/Data Center Cooling](AW=+2.9%, Mild positive signal (z=0.20))","ETN[Industrials/Quality Growth](AW=-1.6%, Positive signal but BM cap-weight dominates (z=0.22)) | HON[Industrials/Quality](AW=-1.6%, Positive signal but BM cap-weight dominates (z=0.43)) | COST[Consumer Staples/Quality Growth](AW=-1.6%, Positive signal but BM cap-weight dominates (z=0.06)) | DE[Industrials/Cyclical](AW=-1.6%, Positive signal but BM cap-weight dominates (z=0.31)) | CAT[Industrials/Cyclical](AW=-1.6%, Positive signal but BM cap-weight dominates (z=0.17)) | NVDA[Semiconductors/Growth](AW=-1.6%, Positive signal but BM cap-weight dominates (z=0.14)) | CRM[Technology/Growth](AW=-1.6%, Positive signal but BM cap-weight dominates (z=0.56)) | FCX[Materials/Cyclical](AW=-1.6%, Strong negative signal (z=-2.04)) | AMD[Semiconductors/Growth](AW=-1.6%, Strong negative signal (z=-2.20)) | BLK[Financials/Quality](AW=-1.6%, Strong negative signal (z=-0.96)) | PLD[Real Estate/Quality](AW=-1.6%, Mild negative signal (z=-0.30)) | AAPL[Technology/Quality Growth](AW=-1.6%, Positive signal but BM cap-weight dominates (z=0.19)) | TSLA[Consumer Disc./Growth](AW=-1.6%, Strong negative signal (z=-1.63)) | PG[Consumer Staples/Defensive](AW=-1.6%, Positive signal but BM cap-weight dominates (z=0.76)) | TMUS[Communication/GARP](AW=-1.6%, Positive signal but BM cap-weight dominates (z=0.54)) | EQIX[Real Estate/Growth](AW=-1.6%, Mild negative signal (z=-0.32)) | LIN[Materials/Quality](AW=-1.6%, Positive signal but BM cap-weight dominates (z=0.29)) | AMT[Real Estate/Defensive](AW=-1.6%, Positive signal but BM cap-weight dominates (z=0.87)) | BE[Industrials/Growth](AW=-1.6%, Strong negative signal (z=-3.07)) | REGN[Healthcare/GARP](AW=-1.6%, Strong negative signal (z=-1.45)) | MA[Financials/Quality Growth](AW=-1.6%, Positive signal but BM cap-weight dominates (z=0.21)) | NEE[Utilities/Defensive](AW=-1.6%, Positive signal but BM cap-weight dominates (z=0.51)) | GS[Financials/Value](AW=-1.6%, Mild negative signal (z=-0.24)) | MU[Semiconductors/Cyclical](AW=-1.6%, Strong negative signal (z=-3.41)) | ISRG[Healthcare/Growth](AW=-1.6%, Positive signal but BM cap-weight dominates (z=0.67)) | LLY[Healthcare/Growth](AW=-1.6%, Positive signal but BM cap-weight dominates (z=0.35)) | UNH[Healthcare/Quality](AW=-1.6%, Strong negative signal (z=-0.60)) | LNG[Energy/Value](AW=-1.6%, Positive signal but BM cap-weight dominates (z=0.04)) | WMT[Consumer Staples/Defensive](AW=-1.5%, Positive signal but BM cap-weight dominates (z=0.11)) | XOM[Energy/Value](AW=-1.3%, Mild negative signal (z=-0.25)) | MCD[Consumer Disc./Defensive](AW=-1.1%, Positive signal but BM cap-weight dominates (z=0.12)) | MSFT[Technology/Quality Growth](AW=-0.7%, Positive signal but BM cap-weight dominates (z=0.30)) | LITE[Technology/Cyclical](AW=-0.3%, Positive signal but BM cap-weight dominates (z=1.01)) | V[Financials/Quality Growth](AW=-0.3%, Positive signal but BM cap-weight dominates (z=0.21))"
2025-10,2025-10-02,Bullish / Low Volatility,"21d EW Ret=+6.03% → Bullish | 21d Vol(ann)=8.2% → Low Volatility | Leading: Semiconductors(+20.90%), Lagging: Materials(-7.57%)",Accounting(56.0%) > Price(19.7%) > Sellside(14.4%) > Conditioning(8.7%) > Factor(1.3%),Technology(+10.8%) | Semiconductors(+6.5%) | Industrials(+6.5%) | Healthcare(+2.8%) | Utilities(-1.6%) | Communication(-1.6%) | Consumer Disc.(-2.7%) | Energy(-2.9%) | Materials(-3.2%) | Consumer Staples(-4.7%) | Real Estate(-4.8%) | Financials(-5.1%),Cyclical(+14.5%) | Value(+4.7%) | Defensive(+0.6%) | GARP(-2.1%) | Growth(-2.3%) | Quality Growth(-7.4%) | Quality(-8.0%),8,34,"PLTR[Technology/Growth/Data Analytics / AI](AW=+10.5%, Very strong positive signal (z=3.06)) | 000660[Semiconductors/Cyclical/Memory (KR)](AW=+10.5%, Very strong positive signal (z=1.86)) | ABBV[Healthcare/Value/Pharma / Biotech](AW=+9.2%, Optimizer risk-adjusted OW despite negative signal (z=-0.02)) | LMT[Industrials/Defensive/Defense / Aerospace](AW=+8.0%, Mild positive signal (z=0.10)) | LITE[Technology/Cyclical/Photonics / Fiber](AW=+4.2%, Very strong positive signal (z=2.22)) | GEV[Industrials/Cyclical/Power Equipment](AW=+3.6%, Strong positive signal (z=0.87)) | VRT[Industrials/Cyclical/Data Center Cooling](AW=+2.9%, Mild positive signal (z=0.03)) | AVGO[Semiconductors/GARP/Networking Chips](AW=+1.1%, Mild positive signal (z=0.18))","ETN[Industrials/Quality Growth](AW=-1.6%, Mild negative signal (z=-0.09)) | HON[Industrials/Quality](AW=-1.6%, Positive signal but BM cap-weight dominates (z=0.06)) | COST[Consumer Staples/Quality Growth](AW=-1.6%, Positive signal but BM cap-weight dominates (z=0.35)) | DE[Industrials/Cyclical](AW=-1.6%, Positive signal but BM cap-weight dominates (z=0.22)) | CAT[Industrials/Cyclical](AW=-1.6%, Mild negative signal (z=-0.22)) | BLK[Financials/Quality](AW=-1.6%, Positive signal but BM cap-weight dominates (z=0.40)) | PLD[Real Estate/Quality](AW=-1.6%, Mild negative signal (z=-0.03)) | FCX[Materials/Cyclical](AW=-1.6%, Positive signal but BM cap-weight dominates (z=0.58)) | PG[Consumer Staples/Defensive](AW=-1.6%, Mild negative signal (z=-0.15)) | EQIX[Real Estate/Growth](AW=-1.6%, Strong negative signal (z=-1.19))","PLTR[Technology/Growth/Data Analytics / AI](AW=+10.5%, Very strong positive signal (z=3.06)) | 000660[Semiconductors/Cyclical/Memory (KR)](AW=+10.5%, Very strong positive signal (z=1.86)) | ABBV[Healthcare/Value/Pharma / Biotech](AW=+9.2%, Optimizer risk-adjusted OW despite negative signal (z=-0.02)) | LMT[Industrials/Defensive/Defense / Aerospace](AW=+8.0%, Mild positive signal (z=0.10)) | LITE[Technology/Cyclical/Photonics / Fiber](AW=+4.2%, Very strong positive signal (z=2.22)) | GEV[Industrials/Cyclical/Power Equipment](AW=+3.6%, Strong positive signal (z=0.87)) | VRT[Industrials/Cyclical/Data Center Cooling](AW=+2.9%, Mild positive signal (z=0.03)) | AVGO[Semiconductors/GARP/Networking Chips](AW=+1.1%, Mild positive signal (z=0.18))","ETN[Industrials/Quality Growth](AW=-1.6%, Mild negative signal (z=-0.09)) | HON[Industrials/Quality](AW=-1.6%, Positive signal but BM cap-weight dominates (z=0.06)) | COST[Consumer Staples/Quality Growth](AW=-1.6%, Positive signal but BM cap-weight dominates (z=0.35)) | DE[Industrials/Cyclical](AW=-1.6%, Positive signal but BM cap-weight dominates (z=0.22)) | CAT[Industrials/Cyclical](AW=-1.6%, Mild negative signal (z=-0.22)) | BLK[Financials/Quality](AW=-1.6%, Positive signal but BM cap-weight dominates (z=0.40)) | PLD[Real Estate/Quality](AW=-1.6%, Mild negative signal (z=-0.03)) | FCX[Materials/Cyclical](AW=-1.6%, Positive signal but BM cap-weight dominates (z=0.58)) | PG[Consumer Staples/Defensive](AW=-1.6%, Mild negative signal (z=-0.15)) | EQIX[Real Estate/Growth](AW=-1.6%, Strong negative signal (z=-1.19)) | TMUS[Communication/GARP](AW=-1.6%, Positive signal but BM cap-weight dominates (z=0.10)) | AMT[Real Estate/Defensive](AW=-1.6%, Mild negative signal (z=-0.02)) | REGN[Healthcare/GARP](AW=-1.6%, Positive signal but BM cap-weight dominates (z=0.01)) | LIN[Materials/Quality](AW=-1.6%, Mild negative signal (z=-0.41)) | MA[Financials/Quality Growth](AW=-1.6%, Positive signal but BM cap-weight dominates (z=0.05)) | TSLA[Consumer Disc./Growth](AW=-1.6%, Strong negative signal (z=-0.56)) | GS[Financials/Value](AW=-1.6%, Positive signal but BM cap-weight dominates (z=0.29)) | CRM[Technology/Growth](AW=-1.6%, Positive signal but BM cap-weight dominates (z=0.35)) | NEE[Utilities/Defensive](AW=-1.6%, Strong negative signal (z=-1.23)) | ISRG[Healthcare/Growth](AW=-1.6%, Positive signal but BM cap-weight dominates (z=0.36)) | LLY[Healthcare/Growth](AW=-1.6%, Positive signal but BM cap-weight dominates (z=0.17)) | AAPL[Technology/Quality Growth](AW=-1.6%, Positive signal but BM cap-weight dominates (z=0.06)) | NVDA[Semiconductors/Growth](AW=-1.6%, Positive signal but BM cap-weight dominates (z=0.15)) | BE[Industrials/Growth](AW=-1.6%, Strong negative signal (z=-2.40)) | AMD[Semiconductors/Growth](AW=-1.6%, Strong negative signal (z=-1.03)) | MU[Semiconductors/Cyclical](AW=-1.6%, Strong negative signal (z=-4.09)) | UNH[Healthcare/Quality](AW=-1.6%, Positive signal but BM cap-weight dominates (z=0.08)) | LNG[Energy/Value](AW=-1.6%, Mild negative signal (z=-0.15)) | WMT[Consumer Staples/Defensive](AW=-1.5%, Mild negative signal (z=-0.01)) | XOM[Energy/Value](AW=-1.3%, Mild negative signal (z=-0.07)) | MCD[Consumer Disc./Defensive](AW=-1.1%, Positive signal but BM cap-weight dominates (z=0.06)) | MSFT[Technology/Quality Growth](AW=-0.7%, Mild negative signal (z=-0.11)) | 005930[Semiconductors/Cyclical](AW=-0.3%, Strong negative signal (z=-1.14)) | V[Financials/Quality Growth](AW=-0.3%, Mild negative signal (z=-0.10))"
2025-11,2025-11-06,Bullish / Low Volatility,"21d EW Ret=+5.12% → Bullish | 21d Vol(ann)=13.7% → Low Volatility | Leading: Semiconductors(+15.94%), Lagging: Materials(-6.77%)",Accounting(56.0%) > Price(19.7%) > Sellside(14.4%) > Conditioning(8.7%) > Factor(1.3%),Technology(+15.9%) | Semiconductors(+5.7%) | Healthcare(+2.8%) | Industrials(+1.1%) | Utilities(-1.6%) | Materials(-1.6%) | Energy(-2.9%) | Communication(-3.2%) | Real Estate(-3.2%) | Consumer Disc.(-3.2%) | Consumer Staples(-4.7%) | Financials(-5.1%),Cyclical(+13.4%) | Value(+4.7%) | Defensive(+4.2%) | Growth(-0.7%) | GARP(-3.2%) | Quality Growth(-9.0%) | Quality(-9.4%),5,33,"PLTR[Technology/Growth/Data Analytics / AI](AW=+10.5%, Very strong positive signal (z=5.14)) | 000660[Semiconductors/Cyclical/Memory (KR)](AW=+10.5%, Strong positive signal (z=0.89)) | LMT[Industrials/Defensive/Defense / Aerospace](AW=+10.5%, Strong positive signal (z=0.89)) | LITE[Technology/Cyclical/Photonics / Fiber](AW=+9.3%, Very strong positive signal (z=1.07)) | ABBV[Healthcare/Value/Pharma / Biotech](AW=+9.2%, Strong positive signal (z=1.00))","MCD[Consumer Disc./Defensive](AW=-1.6%, Strong negative signal (z=-0.52)) | DE[Industrials/Cyclical](AW=-1.6%, Mild negative signal (z=-0.28)) | ETN[Industrials/Quality Growth](AW=-1.6%, Positive signal but BM cap-weight dominates (z=0.17)) | HON[Industrials/Quality](AW=-1.6%, Mild negative signal (z=-0.13)) | CAT[Industrials/Cyclical](AW=-1.6%, Positive signal but BM cap-weight dominates (z=0.09)) | BLK[Financials/Quality](AW=-1.6%, Strong negative signal (z=-0.95)) | TSLA[Consumer Disc./Growth](AW=-1.6%, Mild negative signal (z=-0.18)) | GS[Financials/Value](AW=-1.6%, Mild negative signal (z=-0.07)) | BE[Industrials/Growth](AW=-1.6%, Strong negative signal (z=-1.16)) | MA[Financials/Quality Growth](AW=-1.6%, Mild negative signal (z=-0.08))","PLTR[Technology/Growth/Data Analytics / AI](AW=+10.5%, Very strong positive signal (z=5.14)) | 000660[Semiconductors/Cyclical/Memory (KR)](AW=+10.5%, Strong positive signal (z=0.89)) | LMT[Industrials/Defensive/Defense / Aerospace](AW=+10.5%, Strong positive signal (z=0.89)) | LITE[Technology/Cyclical/Photonics / Fiber](AW=+9.3%, Very strong positive signal (z=1.07)) | ABBV[Healthcare/Value/Pharma / Biotech](AW=+9.2%, Strong positive signal (z=1.00))","MCD[Consumer Disc./Defensive](AW=-1.6%, Strong negative signal (z=-0.52)) | DE[Industrials/Cyclical](AW=-1.6%, Mild negative signal (z=-0.28)) | ETN[Industrials/Quality Growth](AW=-1.6%, Positive signal but BM cap-weight dominates (z=0.17)) | HON[Industrials/Quality](AW=-1.6%, Mild negative signal (z=-0.13)) | CAT[Industrials/Cyclical](AW=-1.6%, Positive signal but BM cap-weight dominates (z=0.09)) | BLK[Financials/Quality](AW=-1.6%, Strong negative signal (z=-0.95)) | TSLA[Consumer Disc./Growth](AW=-1.6%, Mild negative signal (z=-0.18)) | GS[Financials/Value](AW=-1.6%, Mild negative signal (z=-0.07)) | BE[Industrials/Growth](AW=-1.6%, Strong negative signal (z=-1.16)) | MA[Financials/Quality Growth](AW=-1.6%, Mild negative signal (z=-0.08)) | LLY[Healthcare/Growth](AW=-1.6%, Mild negative signal (z=-0.10)) | NEE[Utilities/Defensive](AW=-1.6%, Strong negative signal (z=-1.47)) | REGN[Healthcare/GARP](AW=-1.6%, Mild negative signal (z=-0.19)) | COST[Consumer Staples/Quality Growth](AW=-1.6%, Mild negative signal (z=-0.07)) | LIN[Materials/Quality](AW=-1.6%, Mild negative signal (z=-0.35)) | ISRG[Healthcare/Growth](AW=-1.6%, Mild negative signal (z=-0.07)) | PG[Consumer Staples/Defensive](AW=-1.6%, Mild negative signal (z=-0.20)) | PLD[Real Estate/Quality](AW=-1.6%, Strong negative signal (z=-0.72)) | UNH[Healthcare/Quality](AW=-1.6%, Positive signal but BM cap-weight dominates (z=0.08)) | EQIX[Real Estate/Growth](AW=-1.6%, Strong negative signal (z=-0.74)) | TMUS[Communication/GARP](AW=-1.6%, Positive signal but BM cap-weight dominates (z=0.35)) | 005930[Semiconductors/Cyclical](AW=-1.6%, Strong negative signal (z=-1.35)) | LNG[Energy/Value](AW=-1.6%, Mild negative signal (z=-0.21)) | NVDA[Semiconductors/Growth](AW=-1.6%, Positive signal but BM cap-weight dominates (z=0.00)) | AAPL[Technology/Quality Growth](AW=-1.6%, Mild negative signal (z=-0.14)) | CRM[Technology/Growth](AW=-1.6%, Mild negative signal (z=-0.10)) | MU[Semiconductors/Cyclical](AW=-1.6%, Strong negative signal (z=-2.99)) | GOOGL[Communication/Quality Growth](AW=-1.6%, Mild negative signal (z=-0.18)) | WMT[Consumer Staples/Defensive](AW=-1.5%, Mild negative signal (z=-0.10)) | UNP[Industrials/Quality](AW=-1.4%, Mild negative signal (z=-0.19)) | XOM[Energy/Value](AW=-1.3%, Mild negative signal (z=-0.21)) | MSFT[Technology/Quality Growth](AW=-0.7%, Positive signal but BM cap-weight dominates (z=0.13)) | V[Financials/Quality Growth](AW=-0.3%, Mild negative signal (z=-0.06))"
2025-12,2025-12-11,Bullish / Low Volatility,"21d EW Ret=+3.74% → Bullish | 21d Vol(ann)=12.7% → Low Volatility | Leading: Technology(+12.87%), Lagging: Energy(-5.58%)",Accounting(56.0%) > Price(19.7%) > Sellside(14.4%) > Conditioning(8.7%) > Factor(1.3%),Technology(+6.6%) | Semiconductors(+5.7%) | Communication(+4.7%) | Healthcare(+1.5%) | Industrials(-0.7%) | Financials(-0.8%) | Utilities(-1.6%) | Materials(-1.6%) | Energy(-1.6%) | Real Estate(-3.2%) | Consumer Disc.(-4.2%) | Consumer Staples(-4.8%),GARP(+4.7%) | Value(+4.7%) | Defensive(+4.1%) | Growth(+0.9%) | Cyclical(+0.9%) | Quality(-6.3%) | Quality Growth(-9.0%),6,33,"000660[Semiconductors/Cyclical/Memory (KR)](AW=+10.5%, Very strong positive signal (z=1.91)) | PLTR[Technology/Growth/Data Analytics / AI](AW=+10.5%, Very strong positive signal (z=4.62)) | LMT[Industrials/Defensive/Defense / Aerospace](AW=+10.5%, Strong positive signal (z=0.78)) | ABBV[Healthcare/Value/Pharma / Biotech](AW=+7.9%, Mild positive signal (z=0.36)) | TMUS[Communication/GARP/Wireless Telecom](AW=+6.3%, Strong positive signal (z=0.63)) | SPGI[Financials/Quality/Data / Rating](AW=+4.3%, Very strong positive signal (z=1.13))","LITE[Technology/Cyclical](AW=-1.6%, Strong negative signal (z=-1.38)) | GEV[Industrials/Cyclical](AW=-1.6%, Strong negative signal (z=-0.62)) | GOOGL[Communication/Quality Growth](AW=-1.6%, Mild negative signal (z=-0.12)) | 005930[Semiconductors/Cyclical](AW=-1.6%, Strong negative signal (z=-1.85)) | MCD[Consumer Disc./Defensive](AW=-1.6%, Strong negative signal (z=-0.67)) | DE[Industrials/Cyclical](AW=-1.6%, Mild negative signal (z=-0.08)) | MU[Semiconductors/Cyclical](AW=-1.6%, Strong negative signal (z=-2.82)) | AAPL[Technology/Quality Growth](AW=-1.6%, Positive signal but BM cap-weight dominates (z=0.05)) | NVDA[Semiconductors/Growth](AW=-1.6%, Positive signal but BM cap-weight dominates (z=0.04)) | BLK[Financials/Quality](AW=-1.6%, Mild negative signal (z=-0.15))","000660[Semiconductors/Cyclical/Memory (KR)](AW=+10.5%, Very strong positive signal (z=1.91)) | PLTR[Technology/Growth/Data Analytics / AI](AW=+10.5%, Very strong positive signal (z=4.62)) | LMT[Industrials/Defensive/Defense / Aerospace](AW=+10.5%, Strong positive signal (z=0.78)) | ABBV[Healthcare/Value/Pharma / Biotech](AW=+7.9%, Mild positive signal (z=0.36)) | TMUS[Communication/GARP/Wireless Telecom](AW=+6.3%, Strong positive signal (z=0.63)) | SPGI[Financials/Quality/Data / Rating](AW=+4.3%, Very strong positive signal (z=1.13))","LITE[Technology/Cyclical](AW=-1.6%, Strong negative signal (z=-1.38)) | GEV[Industrials/Cyclical](AW=-1.6%, Strong negative signal (z=-0.62)) | GOOGL[Communication/Quality Growth](AW=-1.6%, Mild negative signal (z=-0.12)) | 005930[Semiconductors/Cyclical](AW=-1.6%, Strong negative signal (z=-1.85)) | MCD[Consumer Disc./Defensive](AW=-1.6%, Strong negative signal (z=-0.67)) | DE[Industrials/Cyclical](AW=-1.6%, Mild negative signal (z=-0.08)) | MU[Semiconductors/Cyclical](AW=-1.6%, Strong negative signal (z=-2.82)) | AAPL[Technology/Quality Growth](AW=-1.6%, Positive signal but BM cap-weight dominates (z=0.05)) | NVDA[Semiconductors/Growth](AW=-1.6%, Positive signal but BM cap-weight dominates (z=0.04)) | BLK[Financials/Quality](AW=-1.6%, Mild negative signal (z=-0.15)) | HON[Industrials/Quality](AW=-1.6%, Positive signal but BM cap-weight dominates (z=0.01)) | ETN[Industrials/Quality Growth](AW=-1.6%, Positive signal but BM cap-weight dominates (z=0.14)) | NEE[Utilities/Defensive](AW=-1.6%, Strong negative signal (z=-1.51)) | GS[Financials/Value](AW=-1.6%, Positive signal but BM cap-weight dominates (z=0.03)) | MA[Financials/Quality Growth](AW=-1.6%, Positive signal but BM cap-weight dominates (z=0.14)) | CAT[Industrials/Cyclical](AW=-1.6%, Positive signal but BM cap-weight dominates (z=0.05)) | TSLA[Consumer Disc./Growth](AW=-1.6%, Mild negative signal (z=-0.08)) | LLY[Healthcare/Growth](AW=-1.6%, Positive signal but BM cap-weight dominates (z=0.07)) | REGN[Healthcare/GARP](AW=-1.6%, Mild negative signal (z=-0.36)) | COST[Consumer Staples/Quality Growth](AW=-1.6%, Mild negative signal (z=-0.15)) | ISRG[Healthcare/Growth](AW=-1.6%, Mild negative signal (z=-0.16)) | EQIX[Real Estate/Growth](AW=-1.6%, Strong negative signal (z=-0.51)) | BE[Industrials/Growth](AW=-1.6%, Strong negative signal (z=-1.78)) | PLD[Real Estate/Quality](AW=-1.6%, Mild negative signal (z=-0.41)) | LIN[Materials/Quality](AW=-1.6%, Positive signal but BM cap-weight dominates (z=0.14)) | PG[Consumer Staples/Defensive](AW=-1.6%, Positive signal but BM cap-weight dominates (z=0.11)) | UNH[Healthcare/Quality](AW=-1.6%, Mild negative signal (z=-0.02)) | UNP[Industrials/Quality](AW=-1.6%, Mild negative signal (z=-0.19)) | WMT[Consumer Staples/Defensive](AW=-1.6%, Positive signal but BM cap-weight dominates (z=0.03)) | XOM[Energy/Value](AW=-1.6%, Mild negative signal (z=-0.17)) | HD[Consumer Disc./Quality](AW=-1.0%, Mild negative signal (z=-0.06)) | MSFT[Technology/Quality Growth](AW=-0.7%, Positive signal but BM cap-weight dominates (z=0.01)) | V[Financials/Quality Growth](AW=-0.3%, Mild negative signal (z=-0.11))"
