year_month,rebal_date,regime_label,regime_reason,dominant_category_effects,sector_tilt,style_tilt,n_ow_stocks,n_uw_stocks,top_ow_details,top_uw_details,all_ow_details,all_uw_details
2025-10,2025-10-03,Bullish / Low Volatility,"21d EW Ret=+8.72% -> Bullish | 21d Vol(ann)=8.7% -> Low Volatility | Leading: Semiconductors(+24.69%), Lagging: Materials(-6.77%)",Accounting(43.3%) > Price(33.5%) > Sellside(11.7%) > Financials(9.4%) > Factor(1.6%) > Conditioning(0.6%),Technology(+9.9%) | Communication(+6.3%) | Healthcare(+5.4%) | Energy(-1.2%) | Utilities(-1.4%) | Consumer Staples(-2.3%) | Materials(-2.6%) | Industrials(-4.1%) | Real Estate(-4.4%) | Financials(-5.8%),Quality Growth(+21.4%) | GARP(+2.2%) | Growth(+0.7%) | Quality(-3.6%) | Value(-4.1%) | Defensive(-5.1%) | Cyclical(-11.5%),13,46,"NVDA[Semiconductors/Growth/AI / GPU](AW=+9.8%, Mild positive signal (z=0.45)) | MSFT[Technology/Quality Growth/Enterprise Software](AW=+9.1%, Optimizer risk-adjusted OW despite negative signal (z=-0.43)) | AAPL[Technology/Quality Growth/Consumer Electronics](AW=+8.7%, Optimizer risk-adjusted OW despite negative signal (z=-0.23)) | GOOGL[Communication/Quality Growth/Digital Advertising](AW=+6.1%, Mild positive signal (z=0.03)) | UNH[Healthcare/Quality/Managed Care](AW=+5.3%, Very strong positive signal (z=3.89)) | GEV[Industrials/Cyclical/Power Equipment](AW=+4.1%, Very strong positive signal (z=1.21)) | REGN[Healthcare/GARP/Biotech](AW=+3.0%, Very strong positive signal (z=1.89)) | AMZN[Consumer Disc./Growth/E-Commerce / Cloud](AW=+2.8%, Optimizer risk-adjusted OW despite negative signal (z=-0.24)) | META[Communication/Quality Growth/Social Media](AW=+2.7%, Strong positive signal (z=0.88)) | LMT[Industrials/Defensive/Defense / Aerospace](AW=+1.8%, Very strong positive signal (z=2.50))","LITE[Technology/Cyclical](AW=-1.6%, Mild negative signal (z=-0.35)) | FN[Technology/Growth](AW=-1.6%, Strong negative signal (z=-2.52)) | BE[Industrials/Growth](AW=-1.6%, Positive signal but BM cap-weight dominates (z=0.47)) | TER[Semiconductors/Cyclical](AW=-1.6%, Strong negative signal (z=-1.43)) | MPWR[Semiconductors/Quality Growth](AW=-1.5%, Strong negative signal (z=-0.60)) | LNG[Energy/Value](AW=-1.5%, Mild negative signal (z=-0.35)) | PLD[Real Estate/Quality](AW=-1.5%, Strong negative signal (z=-0.96)) | FCX[Materials/Cyclical](AW=-1.5%, Strong negative signal (z=-0.93)) | VRT[Industrials/Cyclical](AW=-1.5%, Mild negative signal (z=-0.44)) | EQIX[Real Estate/Growth](AW=-1.5%, Mild negative signal (z=-0.38))","NVDA[Semiconductors/Growth/AI / GPU](AW=+9.8%, Mild positive signal (z=0.45)) | MSFT[Technology/Quality Growth/Enterprise Software](AW=+9.1%, Optimizer risk-adjusted OW despite negative signal (z=-0.43)) | AAPL[Technology/Quality Growth/Consumer Electronics](AW=+8.7%, Optimizer risk-adjusted OW despite negative signal (z=-0.23)) | GOOGL[Communication/Quality Growth/Digital Advertising](AW=+6.1%, Mild positive signal (z=0.03)) | UNH[Healthcare/Quality/Managed Care](AW=+5.3%, Very strong positive signal (z=3.89)) | GEV[Industrials/Cyclical/Power Equipment](AW=+4.1%, Very strong positive signal (z=1.21)) | REGN[Healthcare/GARP/Biotech](AW=+3.0%, Very strong positive signal (z=1.89)) | AMZN[Consumer Disc./Growth/E-Commerce / Cloud](AW=+2.8%, Optimizer risk-adjusted OW despite negative signal (z=-0.24)) | META[Communication/Quality Growth/Social Media](AW=+2.7%, Strong positive signal (z=0.88)) | LMT[Industrials/Defensive/Defense / Aerospace](AW=+1.8%, Very strong positive signal (z=2.50)) | AVGO[Semiconductors/GARP/Networking Chips](AW=+0.6%, Very strong positive signal (z=1.22)) | MPC[Energy/Cyclical/Refining](AW=+0.5%, Mild positive signal (z=0.22)) | LLY[Healthcare/Growth/Pharma / GLP-1](AW=+0.4%, Very strong positive signal (z=1.06))","LITE[Technology/Cyclical](AW=-1.6%, Mild negative signal (z=-0.35)) | FN[Technology/Growth](AW=-1.6%, Strong negative signal (z=-2.52)) | BE[Industrials/Growth](AW=-1.6%, Positive signal but BM cap-weight dominates (z=0.47)) | TER[Semiconductors/Cyclical](AW=-1.6%, Strong negative signal (z=-1.43)) | MPWR[Semiconductors/Quality Growth](AW=-1.5%, Strong negative signal (z=-0.60)) | LNG[Energy/Value](AW=-1.5%, Mild negative signal (z=-0.35)) | PLD[Real Estate/Quality](AW=-1.5%, Strong negative signal (z=-0.96)) | FCX[Materials/Cyclical](AW=-1.5%, Strong negative signal (z=-0.93)) | VRT[Industrials/Cyclical](AW=-1.5%, Mild negative signal (z=-0.44)) | EQIX[Real Estate/Growth](AW=-1.5%, Mild negative signal (z=-0.38)) | GLW[Technology/Cyclical](AW=-1.5%, Strong negative signal (z=-0.82)) | DE[Industrials/Cyclical](AW=-1.5%, Mild negative signal (z=-0.19)) | BLK[Financials/Quality](AW=-1.5%, Mild negative signal (z=-0.49)) | CAT[Industrials/Cyclical](AW=-1.5%, Strong negative signal (z=-0.53)) | ISRG[Healthcare/Growth](AW=-1.5%, Strong negative signal (z=-0.71)) | NEE[Utilities/Defensive](AW=-1.4%, Strong negative signal (z=-1.43)) | MCD[Consumer Disc./Defensive](AW=-1.4%, Mild negative signal (z=-0.37)) | PANW[Technology/Growth](AW=-1.4%, Mild negative signal (z=-0.14)) | 000660[Semiconductors/Cyclical](AW=-1.4%, Mild negative signal (z=-0.37)) | TMUS[Communication/GARP](AW=-1.4%, Strong negative signal (z=-1.66)) | ETN[Industrials/Quality Growth](AW=-1.4%, Strong negative signal (z=-0.85)) | AMD[Semiconductors/Growth](AW=-1.4%, Positive signal but BM cap-weight dominates (z=0.40)) | AMT[Real Estate/Defensive](AW=-1.4%, Positive signal but BM cap-weight dominates (z=0.76)) | JNJ[Healthcare/Defensive](AW=-1.3%, Positive signal but BM cap-weight dominates (z=0.34)) | UNP[Industrials/Quality](AW=-1.3%, Positive signal but BM cap-weight dominates (z=0.14)) | HON[Industrials/Quality](AW=-1.3%, Strong negative signal (z=-0.56)) | LRCX[Semiconductors/Cyclical](AW=-1.3%, Mild negative signal (z=-0.28)) | SPGI[Financials/Quality](AW=-1.3%, Positive signal but BM cap-weight dominates (z=0.20)) | NFLX[Communication/Growth](AW=-1.2%, Positive signal but BM cap-weight dominates (z=0.52)) | AMAT[Semiconductors/Cyclical](AW=-1.2%, Strong negative signal (z=-0.60)) | COST[Consumer Staples/Quality Growth](AW=-1.1%, Mild negative signal (z=-0.14)) | MU[Semiconductors/Cyclical](AW=-1.1%, Mild negative signal (z=-0.20)) | LIN[Materials/Quality](AW=-1.1%, Positive signal but BM cap-weight dominates (z=0.14)) | CRM[Technology/Growth](AW=-1.0%, Positive signal but BM cap-weight dominates (z=0.43)) | WFC[Financials/Value](AW=-1.0%, Mild negative signal (z=-0.31)) | HD[Consumer Disc./Quality](AW=-1.0%, Mild negative signal (z=-0.05)) | GS[Financials/Value](AW=-1.0%, Mild negative signal (z=-0.21)) | V[Financials/Quality Growth](AW=-0.9%, Positive signal but BM cap-weight dominates (z=0.20)) | WMT[Consumer Staples/Defensive](AW=-0.8%, Strong negative signal (z=-0.58)) | PLTR[Technology/Growth](AW=-0.7%, Positive signal but BM cap-weight dominates (z=1.22)) | 005930[Semiconductors/Cyclical](AW=-0.6%, Positive signal but BM cap-weight dominates (z=1.28)) | ABBV[Healthcare/Value](AW=-0.5%, Mild negative signal (z=-0.45)) | PG[Consumer Staples/Defensive](AW=-0.5%, Positive signal but BM cap-weight dominates (z=0.96)) | TSLA[Consumer Disc./Growth](AW=-0.4%, Strong negative signal (z=-0.90)) | MA[Financials/Quality Growth](AW=-0.3%, Mild negative signal (z=-0.43)) | XOM[Energy/Value](AW=-0.2%, Positive signal but BM cap-weight dominates (z=0.73))"
2025-11,2025-11-14,Bullish / Normal Volatility,"21d EW Ret=+2.45% -> Bullish | 21d Vol(ann)=17.2% -> Normal Volatility | Leading: Healthcare(+10.06%), Lagging: Materials(-4.79%)",Accounting(43.3%) > Price(33.5%) > Sellside(11.7%) > Financials(9.4%) > Factor(1.6%) > Conditioning(0.6%),Technology(+9.6%) | Communication(+6.8%) | Healthcare(+4.0%) | Semiconductors(+1.6%) | Consumer Disc.(-0.5%) | Consumer Staples(-0.5%) | Utilities(-1.5%) | Energy(-2.2%) | Materials(-2.9%) | Industrials(-3.7%) | Real Estate(-4.4%) | Financials(-6.2%),Quality Growth(+21.1%) | GARP(+2.4%) | Growth(+1.4%) | Defensive(-2.3%) | Value(-4.2%) | Quality(-5.1%) | Cyclical(-13.4%),13,45,"NVDA[Semiconductors/Growth/AI / GPU](AW=+10.3%, Very strong positive signal (z=1.03)) | AAPL[Technology/Quality Growth/Consumer Electronics](AW=+9.1%, Optimizer risk-adjusted OW despite negative signal (z=-0.10)) | MSFT[Technology/Quality Growth/Enterprise Software](AW=+8.5%, Optimizer risk-adjusted OW despite negative signal (z=-0.45)) | GOOGL[Communication/Quality Growth/Digital Advertising](AW=+7.0%, Optimizer risk-adjusted OW despite negative signal (z=-0.42)) | UNH[Healthcare/Quality/Managed Care](AW=+4.4%, Very strong positive signal (z=2.44)) | GEV[Industrials/Cyclical/Power Equipment](AW=+3.7%, Very strong positive signal (z=1.30)) | AMZN[Consumer Disc./Growth/E-Commerce / Cloud](AW=+3.0%, Optimizer risk-adjusted OW despite negative signal (z=-0.31)) | LMT[Industrials/Defensive/Defense / Aerospace](AW=+2.8%, Strong positive signal (z=0.64)) | REGN[Healthcare/GARP/Biotech](AW=+2.1%, Strong positive signal (z=0.51)) | META[Communication/Quality Growth/Social Media](AW=+2.0%, Optimizer risk-adjusted OW despite negative signal (z=-0.08))","FN[Technology/Growth](AW=-1.7%, Strong negative signal (z=-1.57)) | LITE[Technology/Cyclical](AW=-1.6%, Strong negative signal (z=-1.41)) | TER[Semiconductors/Cyclical](AW=-1.6%, Strong negative signal (z=-2.29)) | BE[Industrials/Growth](AW=-1.6%, Strong negative signal (z=-1.24)) | LNG[Energy/Value](AW=-1.6%, Positive signal but BM cap-weight dominates (z=0.37)) | MPWR[Semiconductors/Quality Growth](AW=-1.6%, Strong negative signal (z=-0.97)) | PLD[Real Estate/Quality](AW=-1.5%, Strong negative signal (z=-0.71)) | FCX[Materials/Cyclical](AW=-1.5%, Mild negative signal (z=-0.48)) | VRT[Industrials/Cyclical](AW=-1.5%, Mild negative signal (z=-0.26)) | BLK[Financials/Quality](AW=-1.5%, Mild negative signal (z=-0.23))","NVDA[Semiconductors/Growth/AI / GPU](AW=+10.3%, Very strong positive signal (z=1.03)) | AAPL[Technology/Quality Growth/Consumer Electronics](AW=+9.1%, Optimizer risk-adjusted OW despite negative signal (z=-0.10)) | MSFT[Technology/Quality Growth/Enterprise Software](AW=+8.5%, Optimizer risk-adjusted OW despite negative signal (z=-0.45)) | GOOGL[Communication/Quality Growth/Digital Advertising](AW=+7.0%, Optimizer risk-adjusted OW despite negative signal (z=-0.42)) | UNH[Healthcare/Quality/Managed Care](AW=+4.4%, Very strong positive signal (z=2.44)) | GEV[Industrials/Cyclical/Power Equipment](AW=+3.7%, Very strong positive signal (z=1.30)) | AMZN[Consumer Disc./Growth/E-Commerce / Cloud](AW=+3.0%, Optimizer risk-adjusted OW despite negative signal (z=-0.31)) | LMT[Industrials/Defensive/Defense / Aerospace](AW=+2.8%, Strong positive signal (z=0.64)) | REGN[Healthcare/GARP/Biotech](AW=+2.1%, Strong positive signal (z=0.51)) | META[Communication/Quality Growth/Social Media](AW=+2.0%, Optimizer risk-adjusted OW despite negative signal (z=-0.08)) | PG[Consumer Staples/Defensive/Household Products](AW=+1.7%, Very strong positive signal (z=2.29)) | AVGO[Semiconductors/GARP/Networking Chips](AW=+1.7%, Strong positive signal (z=0.71)) | LLY[Healthcare/Growth/Pharma / GLP-1](AW=+0.8%, Strong positive signal (z=0.59))","FN[Technology/Growth](AW=-1.7%, Strong negative signal (z=-1.57)) | LITE[Technology/Cyclical](AW=-1.6%, Strong negative signal (z=-1.41)) | TER[Semiconductors/Cyclical](AW=-1.6%, Strong negative signal (z=-2.29)) | BE[Industrials/Growth](AW=-1.6%, Strong negative signal (z=-1.24)) | LNG[Energy/Value](AW=-1.6%, Positive signal but BM cap-weight dominates (z=0.37)) | MPWR[Semiconductors/Quality Growth](AW=-1.6%, Strong negative signal (z=-0.97)) | PLD[Real Estate/Quality](AW=-1.5%, Strong negative signal (z=-0.71)) | FCX[Materials/Cyclical](AW=-1.5%, Mild negative signal (z=-0.48)) | VRT[Industrials/Cyclical](AW=-1.5%, Mild negative signal (z=-0.26)) | BLK[Financials/Quality](AW=-1.5%, Mild negative signal (z=-0.23)) | EQIX[Real Estate/Growth](AW=-1.5%, Positive signal but BM cap-weight dominates (z=0.89)) | GLW[Technology/Cyclical](AW=-1.5%, Mild negative signal (z=-0.10)) | DE[Industrials/Cyclical](AW=-1.5%, Positive signal but BM cap-weight dominates (z=0.12)) | 000660[Semiconductors/Cyclical](AW=-1.5%, Mild negative signal (z=-0.20)) | PANW[Technology/Growth](AW=-1.5%, Mild negative signal (z=-0.30)) | MCD[Consumer Disc./Defensive](AW=-1.5%, Mild negative signal (z=-0.45)) | NEE[Utilities/Defensive](AW=-1.5%, Strong negative signal (z=-1.21)) | CAT[Industrials/Cyclical](AW=-1.5%, Strong negative signal (z=-1.03)) | AMD[Semiconductors/Growth](AW=-1.4%, Strong negative signal (z=-3.91)) | ISRG[Healthcare/Growth](AW=-1.4%, Mild negative signal (z=-0.44)) | TMUS[Communication/GARP](AW=-1.4%, Positive signal but BM cap-weight dominates (z=0.51)) | LIN[Materials/Quality](AW=-1.4%, Positive signal but BM cap-weight dominates (z=0.47)) | ETN[Industrials/Quality Growth](AW=-1.4%, Mild negative signal (z=-0.08)) | AMT[Real Estate/Defensive](AW=-1.4%, Positive signal but BM cap-weight dominates (z=0.63)) | JNJ[Healthcare/Defensive](AW=-1.4%, Positive signal but BM cap-weight dominates (z=0.13)) | UNP[Industrials/Quality](AW=-1.3%, Positive signal but BM cap-weight dominates (z=0.78)) | HON[Industrials/Quality](AW=-1.3%, Positive signal but BM cap-weight dominates (z=0.46)) | MU[Semiconductors/Cyclical](AW=-1.3%, Strong negative signal (z=-0.91)) | LRCX[Semiconductors/Cyclical](AW=-1.3%, Strong negative signal (z=-0.75)) | SPGI[Financials/Quality](AW=-1.3%, Positive signal but BM cap-weight dominates (z=0.33)) | AMAT[Semiconductors/Cyclical](AW=-1.2%, Strong negative signal (z=-0.75)) | WMT[Consumer Staples/Defensive](AW=-1.1%, Positive signal but BM cap-weight dominates (z=0.04)) | COST[Consumer Staples/Quality Growth](AW=-1.1%, Positive signal but BM cap-weight dominates (z=0.56)) | CRM[Technology/Growth](AW=-1.1%, Positive signal but BM cap-weight dominates (z=1.59)) | HD[Consumer Disc./Quality](AW=-1.1%, Positive signal but BM cap-weight dominates (z=0.99)) | TSLA[Consumer Disc./Growth](AW=-1.0%, Mild negative signal (z=-0.18)) | WFC[Financials/Value](AW=-1.0%, Positive signal but BM cap-weight dominates (z=0.11)) | V[Financials/Quality Growth](AW=-1.0%, Positive signal but BM cap-weight dominates (z=0.39)) | GS[Financials/Value](AW=-1.0%, Positive signal but BM cap-weight dominates (z=0.17)) | NFLX[Communication/Growth](AW=-0.8%, Positive signal but BM cap-weight dominates (z=0.67)) | PLTR[Technology/Growth](AW=-0.7%, Mild negative signal (z=-0.01)) | 005930[Semiconductors/Cyclical](AW=-0.6%, Positive signal but BM cap-weight dominates (z=1.28)) | ABBV[Healthcare/Value](AW=-0.5%, Mild negative signal (z=-0.13)) | MPC[Energy/Cyclical](AW=-0.5%, Positive signal but BM cap-weight dominates (z=0.53)) | MA[Financials/Quality Growth](AW=-0.5%, Positive signal but BM cap-weight dominates (z=0.25))"
2025-12,2025-12-12,Sideways / Normal Volatility,"21d EW Ret=+0.64% -> Sideways | 21d Vol(ann)=18.1% -> Normal Volatility | Leading: Materials(+5.30%), Lagging: Energy(-5.12%)",Accounting(43.3%) > Price(33.5%) > Sellside(11.7%) > Financials(9.4%) > Factor(1.6%) > Conditioning(0.6%),Technology(+9.3%) | Communication(+7.1%) | Semiconductors(+2.2%) | Consumer Staples(+0.9%) | Healthcare(+0.8%) | Consumer Disc.(-0.5%) | Utilities(-1.4%) | Energy(-2.2%) | Materials(-2.9%) | Industrials(-3.4%) | Real Estate(-4.3%) | Financials(-5.6%),Quality Growth(+21.0%) | Growth(+1.6%) | GARP(-1.0%) | Defensive(-1.5%) | Value(-3.9%) | Quality(-4.3%) | Cyclical(-11.9%),12,46,"NVDA[Semiconductors/Growth/AI / GPU](AW=+10.3%, Very strong positive signal (z=1.79)) | AAPL[Technology/Quality Growth/Consumer Electronics](AW=+9.1%, Optimizer risk-adjusted OW despite negative signal (z=-0.31)) | MSFT[Technology/Quality Growth/Enterprise Software](AW=+7.8%, Strong positive signal (z=0.67)) | GOOGL[Communication/Quality Growth/Digital Advertising](AW=+7.2%, Optimizer risk-adjusted OW despite negative signal (z=-0.13)) | UNH[Healthcare/Quality/Managed Care](AW=+4.7%, Very strong positive signal (z=2.17)) | GEV[Industrials/Cyclical/Power Equipment](AW=+4.5%, Strong positive signal (z=0.80)) | PG[Consumer Staples/Defensive/Household Products](AW=+3.0%, Very strong positive signal (z=1.87)) | AMZN[Consumer Disc./Growth/E-Commerce / Cloud](AW=+2.8%, Mild positive signal (z=0.40)) | META[Communication/Quality Growth/Social Media](AW=+2.2%, Optimizer risk-adjusted OW despite negative signal (z=-0.29)) | LMT[Industrials/Defensive/Defense / Aerospace](AW=+2.0%, Mild positive signal (z=0.16))","FN[Technology/Growth](AW=-1.6%, Strong negative signal (z=-1.97)) | TER[Semiconductors/Cyclical](AW=-1.6%, Strong negative signal (z=-2.81)) | BE[Industrials/Growth](AW=-1.6%, Positive signal but BM cap-weight dominates (z=0.88)) | LITE[Technology/Cyclical](AW=-1.6%, Positive signal but BM cap-weight dominates (z=0.83)) | LNG[Energy/Value](AW=-1.6%, Positive signal but BM cap-weight dominates (z=0.27)) | MPWR[Semiconductors/Quality Growth](AW=-1.6%, Strong negative signal (z=-1.01)) | VRT[Industrials/Cyclical](AW=-1.5%, Strong negative signal (z=-1.03)) | FCX[Materials/Cyclical](AW=-1.5%, Strong negative signal (z=-0.84)) | PLD[Real Estate/Quality](AW=-1.5%, Strong negative signal (z=-1.45)) | REGN[Healthcare/GARP](AW=-1.5%, Strong negative signal (z=-0.66))","NVDA[Semiconductors/Growth/AI / GPU](AW=+10.3%, Very strong positive signal (z=1.79)) | AAPL[Technology/Quality Growth/Consumer Electronics](AW=+9.1%, Optimizer risk-adjusted OW despite negative signal (z=-0.31)) | MSFT[Technology/Quality Growth/Enterprise Software](AW=+7.8%, Strong positive signal (z=0.67)) | GOOGL[Communication/Quality Growth/Digital Advertising](AW=+7.2%, Optimizer risk-adjusted OW despite negative signal (z=-0.13)) | UNH[Healthcare/Quality/Managed Care](AW=+4.7%, Very strong positive signal (z=2.17)) | GEV[Industrials/Cyclical/Power Equipment](AW=+4.5%, Strong positive signal (z=0.80)) | PG[Consumer Staples/Defensive/Household Products](AW=+3.0%, Very strong positive signal (z=1.87)) | AMZN[Consumer Disc./Growth/E-Commerce / Cloud](AW=+2.8%, Mild positive signal (z=0.40)) | META[Communication/Quality Growth/Social Media](AW=+2.2%, Optimizer risk-adjusted OW despite negative signal (z=-0.29)) | LMT[Industrials/Defensive/Defense / Aerospace](AW=+2.0%, Mild positive signal (z=0.16)) | AVGO[Semiconductors/GARP/Networking Chips](AW=+1.8%, Strong positive signal (z=0.99)) | LLY[Healthcare/Growth/Pharma / GLP-1](AW=+0.8%, Mild positive signal (z=0.34))","FN[Technology/Growth](AW=-1.6%, Strong negative signal (z=-1.97)) | TER[Semiconductors/Cyclical](AW=-1.6%, Strong negative signal (z=-2.81)) | BE[Industrials/Growth](AW=-1.6%, Positive signal but BM cap-weight dominates (z=0.88)) | LITE[Technology/Cyclical](AW=-1.6%, Positive signal but BM cap-weight dominates (z=0.83)) | LNG[Energy/Value](AW=-1.6%, Positive signal but BM cap-weight dominates (z=0.27)) | MPWR[Semiconductors/Quality Growth](AW=-1.6%, Strong negative signal (z=-1.01)) | VRT[Industrials/Cyclical](AW=-1.5%, Strong negative signal (z=-1.03)) | FCX[Materials/Cyclical](AW=-1.5%, Strong negative signal (z=-0.84)) | PLD[Real Estate/Quality](AW=-1.5%, Strong negative signal (z=-1.45)) | REGN[Healthcare/GARP](AW=-1.5%, Strong negative signal (z=-0.66)) | EQIX[Real Estate/Growth](AW=-1.4%, Positive signal but BM cap-weight dominates (z=0.65)) | BLK[Financials/Quality](AW=-1.4%, Mild negative signal (z=-0.41)) | AMD[Semiconductors/Growth](AW=-1.4%, Strong negative signal (z=-3.14)) | PANW[Technology/Growth](AW=-1.4%, Mild negative signal (z=-0.32)) | DE[Industrials/Cyclical](AW=-1.4%, Mild negative signal (z=-0.48)) | GLW[Technology/Cyclical](AW=-1.4%, Positive signal but BM cap-weight dominates (z=0.12)) | 000660[Semiconductors/Cyclical](AW=-1.4%, Positive signal but BM cap-weight dominates (z=0.14)) | NEE[Utilities/Defensive](AW=-1.4%, Strong negative signal (z=-1.03)) | MCD[Consumer Disc./Defensive](AW=-1.4%, Mild negative signal (z=-0.17)) | TMUS[Communication/GARP](AW=-1.4%, Positive signal but BM cap-weight dominates (z=0.20)) | ISRG[Healthcare/Growth](AW=-1.4%, Strong negative signal (z=-1.02)) | CAT[Industrials/Cyclical](AW=-1.4%, Strong negative signal (z=-1.44)) | ETN[Industrials/Quality Growth](AW=-1.4%, Mild negative signal (z=-0.29)) | LIN[Materials/Quality](AW=-1.4%, Positive signal but BM cap-weight dominates (z=0.37)) | AMT[Real Estate/Defensive](AW=-1.4%, Positive signal but BM cap-weight dominates (z=0.12)) | UNP[Industrials/Quality](AW=-1.3%, Mild negative signal (z=-0.03)) | JNJ[Healthcare/Defensive](AW=-1.3%, Mild negative signal (z=-0.20)) | HON[Industrials/Quality](AW=-1.3%, Positive signal but BM cap-weight dominates (z=0.61)) | MU[Semiconductors/Cyclical](AW=-1.3%, Positive signal but BM cap-weight dominates (z=0.34)) | SPGI[Financials/Quality](AW=-1.2%, Positive signal but BM cap-weight dominates (z=0.93)) | LRCX[Semiconductors/Cyclical](AW=-1.2%, Strong negative signal (z=-0.59)) | AMAT[Semiconductors/Cyclical](AW=-1.1%, Strong negative signal (z=-1.06)) | COST[Consumer Staples/Quality Growth](AW=-1.1%, Positive signal but BM cap-weight dominates (z=0.66)) | WMT[Consumer Staples/Defensive](AW=-1.0%, Mild negative signal (z=-0.09)) | HD[Consumer Disc./Quality](AW=-1.0%, Positive signal but BM cap-weight dominates (z=0.25)) | CRM[Technology/Growth](AW=-1.0%, Positive signal but BM cap-weight dominates (z=1.34)) | V[Financials/Quality Growth](AW=-0.9%, Mild negative signal (z=-0.11)) | WFC[Financials/Value](AW=-0.9%, Positive signal but BM cap-weight dominates (z=0.06)) | NFLX[Communication/Growth](AW=-0.9%, Positive signal but BM cap-weight dominates (z=1.15)) | TSLA[Consumer Disc./Growth](AW=-0.9%, Positive signal but BM cap-weight dominates (z=0.67)) | GS[Financials/Value](AW=-0.9%, Mild negative signal (z=-0.07)) | PLTR[Technology/Growth](AW=-0.6%, Mild negative signal (z=-0.15)) | ABBV[Healthcare/Value](AW=-0.6%, Positive signal but BM cap-weight dominates (z=0.27)) | MPC[Energy/Cyclical](AW=-0.5%, Positive signal but BM cap-weight dominates (z=0.82)) | 005930[Semiconductors/Cyclical](AW=-0.4%, Positive signal but BM cap-weight dominates (z=1.30)) | MA[Financials/Quality Growth](AW=-0.4%, Positive signal but BM cap-weight dominates (z=0.02))"
